Author;Date;Content;Attachments;
lilvon#5479;07-Mar-18 08:25 PM;@NVCGN1985#1494;;
NVCGN1985#1494;07-Mar-18 08:27 PM;Nice;;
NVCGN1985#1494;07-Mar-18 08:27 PM;Mucho better;;
NVCGN1985#1494;07-Mar-18 08:28 PM;"Alright, my stink ass needs to shower, and put cheap moves on the wife.";;
NVCGN1985#1494;07-Mar-18 08:28 PM;I'll be back in a few.;;
lilvon#5479;07-Mar-18 08:28 PM;Take your time.;;
themockingguy#6969;07-Mar-18 08:32 PM;Is this one is the guys you were telling me about?;;
themockingguy#6969;07-Mar-18 08:32 PM;"@NVCGN1985#1494 hello!, I'm the noob he was helping.";;
Thelitedragon#4507;07-Mar-18 08:43 PM;oh!?;;
Thelitedragon#4507;07-Mar-18 08:43 PM;Poor old Bev.;;
Thelitedragon#4507;07-Mar-18 08:43 PM;He's probably felt a disturbance in the force;;
Thelitedragon#4507;07-Mar-18 08:44 PM;"I'm another noob, but I don't really have the cash to buy XIV atm lol";;
Thelitedragon#4507;07-Mar-18 08:44 PM;Actually come to think of it I might buy it on PS4;;
themockingguy#6969;07-Mar-18 08:48 PM;"It's on sale, 30usd for the complete edition";;
themockingguy#6969;07-Mar-18 08:49 PM;"Join us, we could do the main quest together since we're both new";;
Thelitedragon#4507;07-Mar-18 08:49 PM;Maybe!;;
NVCGN1985#1494;07-Mar-18 08:56 PM;Hello Shinji;;
themockingguy#6969;07-Mar-18 08:57 PM;ðŸ‘‹;;
NVCGN1985#1494;07-Mar-18 08:58 PM;Von speaks of me does he? lol;;
NVCGN1985#1494;07-Mar-18 08:58 PM;"In whispered tones, cackling evilly I hope.";;
Thelitedragon#4507;07-Mar-18 08:59 PM;"He tells us the legends, but they were so fantastical that I didn't believe them";;
themockingguy#6969;07-Mar-18 08:59 PM;He told me about some old memebers of the FC that doesn't play anymore;;
themockingguy#6969;07-Mar-18 08:59 PM;"he mentioned dads, and saw the convo you were having";;
themockingguy#6969;07-Mar-18 08:59 PM;I put 2 and 2 together;;
Thelitedragon#4507;07-Mar-18 09:00 PM;Buying FFXIV;;
NVCGN1985#1494;07-Mar-18 09:00 PM;Nice.;;
Thelitedragon#4507;07-Mar-18 09:00 PM;Turns out your last name can't have less than 3 letters;;
Thelitedragon#4507;07-Mar-18 09:00 PM;like irl last name;;
NVCGN1985#1494;07-Mar-18 09:00 PM;I used to play before life happened and my ps4 ecploded;;
NVCGN1985#1494;07-Mar-18 09:00 PM;But I'll be back once I get my computer.;;
themockingguy#6969;07-Mar-18 09:01 PM;"Nice, sounds like he's planing to revive the FC";;
lilvon#5479;07-Mar-18 09:01 PM;Yeah i sent them the convo we were having & demanded they return lol;;
Thelitedragon#4507;07-Mar-18 09:02 PM;Are they the Canadians of Legend?;;
Thelitedragon#4507;07-Mar-18 09:02 PM;Hi from Calgary lol;;
lilvon#5479;07-Mar-18 09:02 PM;"Yes, yes they are!";;
themockingguy#6969;07-Mar-18 09:02 PM;Are you all canadian?;;
NVCGN1985#1494;07-Mar-18 09:02 PM;"Alas we are, Beaver riding maniacs, with swords of molten maple, folded razor edges of our bacon blades.";;
Thelitedragon#4507;07-Mar-18 09:02 PM;Von is living in Alabama;;
Thelitedragon#4507;07-Mar-18 09:03 PM;~~I make billions in the oil sands and bitch when there's an economic downturn~~;;
Thelitedragon#4507;07-Mar-18 09:03 PM;"Ah, Alberta.";;
NVCGN1985#1494;07-Mar-18 09:03 PM;lol;;
NVCGN1985#1494;07-Mar-18 09:03 PM;That's so scarily accurate;;
NVCGN1985#1494;07-Mar-18 09:03 PM;#Ndpsfault;;
NVCGN1985#1494;07-Mar-18 09:03 PM;#Federalgovernmentsfault;;
NVCGN1985#1494;07-Mar-18 09:03 PM;#Bcsfault;;
NVCGN1985#1494;07-Mar-18 09:03 PM;#Quebecsfault;;
Thelitedragon#4507;07-Mar-18 09:04 PM;As I've said here before: The Canadian political climate is a circus greater than or equal to that of the United States;;
NVCGN1985#1494;07-Mar-18 09:04 PM;"Greater, the circus is louder, stranger even.";;
NVCGN1985#1494;07-Mar-18 09:05 PM;But the ripples from our circus are much smaller than the Americans thunderous cannonballs into the political ocean;;
Thelitedragon#4507;07-Mar-18 09:05 PM;"Man, you are a master of the English language.";;
NVCGN1985#1494;07-Mar-18 09:06 PM;"lol, well, haven't heard a compliment like that in a while.";;
Thelitedragon#4507;07-Mar-18 09:07 PM;YES!!! I HAVE THE POWER!!!;https://cdn.discordapp.com/attachments/421131276440043537/421141920207601665/hehe.PNG;
NVCGN1985#1494;07-Mar-18 09:08 PM;"I must say, one of the saddest things in the world is watching Canadian politicians jibe back and forth in the house of commons. It's so angry, and so polite at the same time.";;
Thelitedragon#4507;07-Mar-18 09:08 PM;The funniest thing is the lowkey animosity on Twitter during mayoral elections;;
NVCGN1985#1494;07-Mar-18 09:09 PM;LOL;;
themockingguy#6969;07-Mar-18 09:09 PM;"Yes @Thelitedragon#4507 ðŸ™Œ , I can't play today anymore, but maybe tomorrow we can play together";;
!-Jisoo of the Common World-!#8403;07-Mar-18 09:10 PM;what's this;;
Thelitedragon#4507;07-Mar-18 09:10 PM;I HAVE THE POWER!;;
Thelitedragon#4507;07-Mar-18 09:10 PM;I CAN ACCESS THE LODESTONE REEEEEEE;;
themockingguy#6969;07-Mar-18 09:10 PM;I'm playing from around 6pm to 8:30 ~ 9:00CST;;
!-Jisoo of the Common World-!#8403;07-Mar-18 09:10 PM;but do you have the power of the seasons?;;
!-Jisoo of the Common World-!#8403;07-Mar-18 09:10 PM;I don't think so;;
themockingguy#6969;07-Mar-18 09:10 PM;The FFXIV channel;;
NVCGN1985#1494;07-Mar-18 09:10 PM;By the power of Greyskull;;
Thelitedragon#4507;07-Mar-18 09:11 PM;;https://cdn.discordapp.com/attachments/421131276440043537/421142799828779038/z9dne0k6fvoz.jpg;
Thelitedragon#4507;07-Mar-18 09:11 PM;By the nine;;
!-Jisoo of the Common World-!#8403;07-Mar-18 09:11 PM;oh yeah for FFXIV;;
!-Jisoo of the Common World-!#8403;07-Mar-18 09:11 PM;shit I still need to transfer;;
NVCGN1985#1494;07-Mar-18 09:11 PM;Good god Joker thats ruthless;;
NVCGN1985#1494;07-Mar-18 09:11 PM;Naheed went straight for the jugular;;
themockingguy#6969;07-Mar-18 09:12 PM;@lilvon#5479 Might be a good idea to link and pin the FC lodestone link here;;
Thelitedragon#4507;07-Mar-18 09:12 PM;Nensh is kench;;
Thelitedragon#4507;07-Mar-18 09:13 PM;Now that I'm a standard member I can join the FC too;;
NVCGN1985#1494;07-Mar-18 09:14 PM;Many Bothans died to get you that FC invite Joker....;;
NVCGN1985#1494;07-Mar-18 09:14 PM;"Don't waste it...-dramatically dies backlit by sunset, and doves flying across the horizon-";;
Thelitedragon#4507;07-Mar-18 09:15 PM;"Like a said, a master of the English language.";;
Thelitedragon#4507;07-Mar-18 09:15 PM;The Shakespeare of the New West;;
lilvon#5479;07-Mar-18 09:16 PM;Im sorry Nate the name had to change but the OG Bothans will be getting a special rank for their sacrifice!;;
NVCGN1985#1494;07-Mar-18 09:17 PM;"It's ok La'von, we knew it must happen, one day";;
NVCGN1985#1494;07-Mar-18 09:17 PM;ðŸ˜­;;
Thelitedragon#4507;07-Mar-18 09:17 PM;:9999: :hit:;;
NVCGN1985#1494;07-Mar-18 09:17 PM;How long can a rank be titled ?;;
NVCGN1985#1494;07-Mar-18 09:18 PM;"Because if Maple Bacon Knight is an option, that's my prefered rank";;
Thelitedragon#4507;07-Mar-18 09:19 PM;Man that'll just make me jealous...;;
themockingguy#6969;07-Mar-18 09:19 PM;Yo' @Thelitedragon#4507 let @lilvon#5479 give you his recutment code so you and him get some goodies;;
Thelitedragon#4507;07-Mar-18 09:19 PM;I wanna be a Seal Clubber Knight ðŸ˜«;;
Thelitedragon#4507;07-Mar-18 09:19 PM;"Will do, when I get onto my PC";;
Seymour#0747;07-Mar-18 09:34 PM;is this some ffxiv thing;;
Psychotic Ninja#0661;07-Mar-18 09:37 PM;What is this Reddit Wings?;;
Thelitedragon#4507;07-Mar-18 09:42 PM;The Reddit Wings is the Official FFXIV Free Company of the Final Fantasy Subreddit! Aether Datacenter Siren Server.;https://cdn.discordapp.com/attachments/421131276440043537/421150590689607701/20180217_115352.jpg;
Thelitedragon#4507;07-Mar-18 09:42 PM;Pinned a message.;;
Thelitedragon#4507;07-Mar-18 09:48 PM;"In other news, I realized that since I bought the complete edition, I have to download stormblood";;
Thelitedragon#4507;07-Mar-18 09:48 PM;So that's 10 gigs in between me and that sweet sweet MMO goodness;;
themockingguy#6969;07-Mar-18 09:53 PM;Ikr;;
themockingguy#6969;07-Mar-18 09:53 PM;It happened to me too;;
themockingguy#6969;07-Mar-18 09:54 PM;I wanted to play because I have limited playtime on workdays;;
themockingguy#6969;07-Mar-18 09:54 PM;Thankfully my ISP had it's shit together;;
Thelitedragon#4507;07-Mar-18 09:54 PM;"I mean I just downloaded XV while I was at school, so 10gb isn't too bad";;
themockingguy#6969;07-Mar-18 10:14 PM;I will be hopping back in like 30 minutes of anyone of you are in right now;;
themockingguy#6969;07-Mar-18 10:46 PM;@Thelitedragon#4507 are you logged in?;;
Malfred#1000;08-Mar-18 12:39 AM;Oh lovely;;
Pecca#5742;08-Mar-18 12:39 AM;What is this room;;
Malfred#1000;08-Mar-18 12:39 AM;It is up and running;;
Malfred#1000;08-Mar-18 12:39 AM;Scroll up Pecca;;
Seymour#0747;08-Mar-18 12:43 AM;ðŸ“Œ;;
Malfred#1000;08-Mar-18 12:45 AM;"Or look at the pinned message, yes";;
Pecca#5742;08-Mar-18 12:46 AM;Muted;;
themockingguy#6969;08-Mar-18 01:15 AM;Rud;;
Malfred#1000;08-Mar-18 01:18 AM;A rudder you say?;;
Malfred#1000;08-Mar-18 01:18 AM;TILL SEA SWALLOWS ALL;;
Malfred#1000;08-Mar-18 01:19 AM;Maelstrom is best Grand Company;;
themockingguy#6969;08-Mar-18 01:22 AM;T I L L  S E A  S W A L L O W S  A L L;;
themockingguy#6969;08-Mar-18 01:23 AM;"That's the grand company I choose in the other server, probably will again this time";;
Malfred#1000;08-Mar-18 01:29 AM;As you well should;;
NVCGN1985#1494;08-Mar-18 05:57 PM;"@lilvon#5479 So, the OG Bothan titles set yet? Because I inquired as to getting the rank of Maple Bacon Knight?";;
NVCGN1985#1494;08-Mar-18 05:57 PM;I think it fits.;;
themockingguy#6969;08-Mar-18 06:13 PM;"IÂ´m going online, if any one of you wants to join me ðŸ˜ƒ";;
Thelitedragon#4507;08-Mar-18 07:26 PM;I'll see if I can get on soon;;
themockingguy#6969;08-Mar-18 07:55 PM;What's your in-game name @Thelitedragon#4507 ?;;
themockingguy#6969;08-Mar-18 07:57 PM;So i can send you a friend request and a FC invite;;
Silverx1987#9781;08-Mar-18 08:06 PM;Don't do it! Block him along with all those goldspammers!;;
Silverx1987#9781;08-Mar-18 08:06 PM;Just kidding!;;
Silverx1987#9781;08-Mar-18 08:06 PM;gilspammers rather.;;
Silverx1987#9781;08-Mar-18 08:07 PM;"Wonder if Square Enix got rid of those gilspammers,  I remember my block list was full last time I played.";;
themockingguy#6969;08-Mar-18 08:52 PM;They put out regular post with the number of bans for RMT;;
themockingguy#6969;08-Mar-18 08:52 PM;the last one they said they've  banned 4000+ accounts iirc;;
lilvon#5479;08-Mar-18 09:35 PM;Sorry i wasnt able to get on to add everyone. Ive been pretty sick and literally slept like 10 hours & have to go to work now. If you leave an application for the FC I can add you when i get off on the morning.;;
lilvon#5479;08-Mar-18 09:36 PM;Also @NVCGN1985#1494 FC titles habe to be 15 letters or shorter so no maple bacon knight unfortunately. :-c;;
themockingguy#6969;08-Mar-18 09:36 PM;I added Joker already von;;
lilvon#5479;08-Mar-18 09:37 PM;Oh nice!;;
themockingguy#6969;08-Mar-18 09:37 PM;"You need to just give him his welcome gifts ;)";;
lilvon#5479;08-Mar-18 09:37 PM;Will do!;;
NVCGN1985#1494;08-Mar-18 09:37 PM;Nooooo;;
NVCGN1985#1494;08-Mar-18 09:37 PM;15 characters;;
NVCGN1985#1494;08-Mar-18 09:37 PM;MapleBaconKing;;
Thelitedragon#4507;08-Mar-18 09:37 PM;Some compromise must be reached for us northerners;;
NVCGN1985#1494;08-Mar-18 09:37 PM;MapleBaconBeast;;
NVCGN1985#1494;08-Mar-18 09:37 PM;MapleBaconGod;;
NVCGN1985#1494;08-Mar-18 09:38 PM;"There, god works";;
Thelitedragon#4507;08-Mar-18 09:38 PM;MapleBaconMonks;;
Thelitedragon#4507;08-Mar-18 09:38 PM;lol;;
Thelitedragon#4507;08-Mar-18 09:38 PM;"We need more Canadian stereotypes, damnit";;
themockingguy#6969;08-Mar-18 09:38 PM;"If they can get a special title just for being Canadians, I want mine to be Taco Warrior";;
themockingguy#6969;08-Mar-18 09:38 PM;:P;;
themockingguy#6969;08-Mar-18 09:39 PM;Or something Aztec;;
themockingguy#6969;08-Mar-18 09:39 PM;Jaguar Warrior;;
themockingguy#6969;08-Mar-18 09:40 PM;That sounds dope;;
lilvon#5479;08-Mar-18 10:25 PM;"The title is for the original FC members the ones who are around before it was converted into Reddit wings, many of which happened to be Canadian";;
Malfred#1000;09-Mar-18 03:38 PM;Needs more crystals;;
Malfred#1000;09-Mar-18 03:39 PM;And a crafter rank;;
Thelitedragon#4507;09-Mar-18 06:20 PM;lol locked out of my account;;
Thelitedragon#4507;09-Mar-18 06:20 PM;Probably because I logged in from McDonalds wifi like an idiot;;
Thelitedragon#4507;09-Mar-18 06:27 PM;And worse yet I can't remember the security question...;;
!-Jisoo of the Common World-!#8403;09-Mar-18 06:40 PM;just reset it;;
!-Jisoo of the Common World-!#8403;09-Mar-18 06:40 PM;SE's account thing is pretty garbo;;
!-Jisoo of the Common World-!#8403;09-Mar-18 06:40 PM;they locked my account that I have not used in over a year lol;;
Thelitedragon#4507;09-Mar-18 06:46 PM;It's also bs that you have to pay for a mobile authenticator;;
Thelitedragon#4507;09-Mar-18 06:46 PM;Unless I'm reading into it wrong;;
!-Jisoo of the Common World-!#8403;09-Mar-18 06:52 PM;idk what that is;;
!-Jisoo of the Common World-!#8403;09-Mar-18 06:52 PM;I just have a normal password set up;;
themockingguy#6969;09-Mar-18 06:54 PM;"You can have a hardware authenticator that costs money, but you can also use an app that's free";;
themockingguy#6969;09-Mar-18 06:54 PM;But the reviews for the app says it's pretty crappy;;
Left Side Worldwide#6969;09-Mar-18 07:30 PM;The app is not good;;
Left Side Worldwide#6969;09-Mar-18 07:30 PM;But it is functional;;
lilvon#5479;09-Mar-18 08:45 PM;I swear nothing gives me more anxiety than tanking in FFXIV ðŸ˜“ ðŸ˜“ ðŸ˜“;;
lilvon#5479;09-Mar-18 08:46 PM;Its probably my least favorite thing to do in this game.... i swear i only run Dark Knight cause its A E S T H E T I C;;
Malfred#1000;10-Mar-18 12:21 AM;Big swords too;;
Malfred#1000;10-Mar-18 09:01 AM;I'm around to assist with the early dungeons if anyone needs to do them;;
Malfred#1000;10-Mar-18 09:01 AM;"And I can tank, so Don can lean back and heal.";;
Thelitedragon#4507;10-Mar-18 09:06 AM;I can get on pretty soon actually;;
Thelitedragon#4507;10-Mar-18 09:06 AM;Just lemme get out of bed;;
Malfred#1000;10-Mar-18 10:03 AM;"You just say when, and I'll log in to help.";;
themockingguy#6969;10-Mar-18 11:18 AM;"I just got out of bed, I'll hop on in little while";;
lilvon#5479;10-Mar-18 04:40 PM;I got kicked out... and game is now frozen trying to log in.;;
Malfred#1000;10-Mar-18 04:40 PM;Ah;;
lilvon#5479;10-Mar-18 04:40 PM;Yeah having PSN issues.;;
Malfred#1000;10-Mar-18 04:41 PM;"Let the game log your char out first, as well";;
themockingguy#6969;10-Mar-18 04:43 PM;Restart everything?;;
lilvon#5479;10-Mar-18 06:01 PM;@Leon#9542 formed a KPop group with some AFKers in Limsa. What should our name be?;https://cdn.discordapp.com/attachments/421131276440043537/422182243981852701/29102161_1681648441902103_50411044765433856_o.jpg,https://cdn.discordapp.com/attachments/421131276440043537/422182243981852704/28958780_1681648445235436_8976740566448472064_o.jpg;
Leon#9542;10-Mar-18 06:08 PM;"first off, I'm bad at names so I have no idea";;
Leon#9542;10-Mar-18 06:08 PM;"and secondly, I'm so insulted that you would form a kpop group without me. ðŸ˜¢";;
lilvon#5479;10-Mar-18 06:12 PM;You are more than welcome to join as sion as you start playing lol!;;
themockingguy#6969;10-Mar-18 07:52 PM;Cool I didn't know this was a thing;https://cdn.discordapp.com/attachments/421131276440043537/422210105082118154/Screenshot_20180310-195122.png;
lilvon#5479;10-Mar-18 08:16 PM;I didnt know that was a thing either...;;
Thelitedragon#4507;10-Mar-18 10:51 PM;welp time to go back to the dark side;;
Thelitedragon#4507;10-Mar-18 10:52 PM;"My computer has a problem with freezing, as well as those internet problems I mentioned earlier";;
Thelitedragon#4507;10-Mar-18 10:52 PM;so hopefully I fixed that;;
lilvon#5479;11-Mar-18 02:58 AM;Just finished up the Yojimbo fight.;;
lilvon#5479;11-Mar-18 02:59 AM;Heres an image i put together comparing his original appearance in FFX to how he appears in FFXIV Stormblood;https://cdn.discordapp.com/attachments/421131276440043537/422317694621188096/DEXATI20180311035734.png;
Malfred#1000;11-Mar-18 03:33 AM;They're nearly 1-1;;
Malfred#1000;11-Mar-18 03:33 AM;And it is glorious;;
!-Jisoo of the Common World-!#8403;11-Mar-18 09:04 AM;man I see everyone having fun with all the SB content and it will be years before I get there lol;;
!-Jisoo of the Common World-!#8403;11-Mar-18 09:05 AM;saw the Ivalice raid and it was amazing;;
lilvon#5479;11-Mar-18 09:05 AM;Lol i was queuing for the Ivalice raid about an hour ago as Id just unlocked it myself.;;
lilvon#5479;11-Mar-18 09:06 AM;But its so early in the morning no ones queuing for it.;;
Left Side Worldwide#6969;11-Mar-18 09:07 AM;You were what now?;;
lilvon#5479;11-Mar-18 09:24 AM;"Woot fat fingers, give me a sec to edit that! :thief:";;
!-Jisoo of the Common World-!#8403;11-Mar-18 09:33 AM;man I can't wait;;
!-Jisoo of the Common World-!#8403;11-Mar-18 09:34 AM;it's crazy how much effort consistently goes into this game;;
lilvon#5479;11-Mar-18 09:35 AM;Yeah XIV was SE only saving grace for a while with how bad the launch version of FFXV was.;;
lilvon#5479;11-Mar-18 09:35 AM;What level are you?;;
!-Jisoo of the Common World-!#8403;11-Mar-18 09:35 AM;37;;
!-Jisoo of the Common World-!#8403;11-Mar-18 09:35 AM;a long way to go;;
lilvon#5479;11-Mar-18 09:36 AM;What server?;;
!-Jisoo of the Common World-!#8403;11-Mar-18 09:36 AM;lamia;;
lilvon#5479;11-Mar-18 09:37 AM;Ah neat. Yeah you could always buy a skip potion & jump right into Stormblood but youd be doing yourself a MAJOR disservice skipping Heavensward....;;
lilvon#5479;11-Mar-18 09:37 AM;(You should also buy a server transfer to Siren);;
!-Jisoo of the Common World-!#8403;11-Mar-18 09:38 AM;is there a way to skip to just the end of ARR?;;
!-Jisoo of the Common World-!#8403;11-Mar-18 09:39 AM;also yeah I might switch over;;
lilvon#5479;11-Mar-18 09:41 AM;I beleive their is... Let me check mogstation;;
lilvon#5479;11-Mar-18 09:42 AM;;https://cdn.discordapp.com/attachments/421131276440043537/422419057564975104/Screenshot_20180311-104208.jpg;
lilvon#5479;11-Mar-18 09:43 AM;The $18 option will rocket you up to the start of Heavensward.;;
lilvon#5479;11-Mar-18 09:44 AM;Honestly Ive been debating on writing up a FFXIV crash course plot summary for those who decide to buy their way into Stormblood/Heavensward.;;
!-Jisoo of the Common World-!#8403;11-Mar-18 09:45 AM;nice;;
!-Jisoo of the Common World-!#8403;11-Mar-18 09:45 AM;I'll be looking into this;;
!-Jisoo of the Common World-!#8403;11-Mar-18 09:46 AM;I have not been in the mood to play lately due to the RtY event for Bloodborne;;
!-Jisoo of the Common World-!#8403;11-Mar-18 09:46 AM;and ARR is a real chore tbh;;
lilvon#5479;11-Mar-18 09:46 AM;Its a huge time saver as their are approximately 100 quests between The end of ARR base story & the start of Heavensward.;;
lilvon#5479;11-Mar-18 09:47 AM;"Yeah i picked up free Bloodborne, cant wait to play it 6 months from now when im not putting 5+ hours into XIV every day! :pupu:";;
!-Jisoo of the Common World-!#8403;11-Mar-18 09:47 AM;have fun;;
themockingguy#6969;11-Mar-18 10:42 AM;Is there really that much quests between the base game and the expansions;;
Left Side Worldwide#6969;11-Mar-18 10:44 AM;Yes;;
Malfred#1000;11-Mar-18 10:47 AM;Yup;;
Malfred#1000;11-Mar-18 10:47 AM;"Not quite as many between HW and SB, but still a lot";;
Silverx1987#9781;11-Mar-18 10:52 AM;"Not sure why anyone would skip the MSQ though, especially on their first playthrough.";;
Silverx1987#9781;11-Mar-18 10:52 AM;The storyline is great.;;
Malfred#1000;11-Mar-18 10:53 AM;Not so much the original storyline;;
Malfred#1000;11-Mar-18 10:53 AM;"But yeah, the content between ARR and HW was pretty darn good";;
Malfred#1000;11-Mar-18 10:54 AM;"If nothing else, skipping does unlock the cutscenes in your journal in the inn room";;
Malfred#1000;11-Mar-18 10:54 AM;So you can always sit down and watch them that way;;
!-Jisoo of the Common World-!#8403;11-Mar-18 11:02 AM;I think the overall plot of ARR is fine;;
!-Jisoo of the Common World-!#8403;11-Mar-18 11:03 AM;but the way it plays out in the questline is so boring;;
!-Jisoo of the Common World-!#8403;11-Mar-18 11:03 AM;too many errand boy quests;;
Thelitedragon#4507;11-Mar-18 11:04 AM;Even if I just blast through the main story it'll take like a year to get to HW :HAHAHAHAHA:;;
!-Jisoo of the Common World-!#8403;11-Mar-18 11:04 AM;so it is a tease to know that the fun parts are really in the post game of ARR and the two expansions;;
Silverx1987#9781;11-Mar-18 11:33 AM;"When I played it, A Realm Reborn took me over 200hrs to complete.";;
Silverx1987#9781;11-Mar-18 11:34 AM;I'm assuming Heavensward and Stormblood would probably be similar.;;
Silverx1987#9781;11-Mar-18 11:36 AM;"I heaven't completed all of Heavensward, like the post expansion stuff. But I clock in at around 1k hours from start of A Realm Reborn to Heavensward.";;
lilvon#5479;11-Mar-18 11:40 AM;I'm not a fan of A Realm Reborn storyline. I think heavensward is fantastic and stormblood is somewhere in the middle;;
lilvon#5479;11-Mar-18 11:41 AM;Just finished the ivalice raid they were painful because I didn't look up a guide but they're still super dope;;
Silverx1987#9781;11-Mar-18 11:41 AM;"I didn't mind it, probably because I spent the first two years playing it. So it amounts to most of the moments I've spent in Final Fantasy XIV.";;
Silverx1987#9781;11-Mar-18 11:42 AM;Even though I didn't reach level 50 until patch 2.1 launched.;;
Silverx1987#9781;11-Mar-18 11:43 AM;But patch 2.1 was probably the best patch that had ever launched. Crystal Tower was just to awesome.;;
Silverx1987#9781;11-Mar-18 11:44 AM;The Ivalice raid is a 24man right?;;
lilvon#5479;11-Mar-18 11:45 AM;"Yep, you fight Tactics and FFXII bosses/summons";;
Thelitedragon#4507;11-Mar-18 02:17 PM;I love how right before the ifrit dungeon you get captured;;
Thelitedragon#4507;11-Mar-18 02:17 PM;Then I just teleported straight to the gold saucer;;
Malfred#1000;11-Mar-18 02:29 PM;"Canonically the other captives find a way out, but are afraid of being found out if they all flee, so they send you out to get reinforcements.";;
Thelitedragon#4507;11-Mar-18 02:34 PM;Yeah and I went to gamble ðŸ‘€ :;;
Thelitedragon#4507;11-Mar-18 02:35 PM;"In other news, I walked from Limsa to Costa Del Sol";;
Thelitedragon#4507;11-Mar-18 02:35 PM;Screw the ferry;;
Silverx1987#9781;11-Mar-18 02:36 PM;Walked or ran/mount?;;
Thelitedragon#4507;11-Mar-18 02:37 PM;*walked*;;
Thelitedragon#4507;11-Mar-18 02:37 PM;/sprinted;;
Malfred#1000;11-Mar-18 02:39 PM;As did I;;
Malfred#1000;11-Mar-18 02:40 PM;Mostly because I was in the neighbourhood already at level 5;;
Malfred#1000;11-Mar-18 02:40 PM;(doing quests around Red Rooster Stead);;
Thelitedragon#4507;11-Mar-18 02:41 PM;I tried to get there from the wrong side of la noscea;;
Thelitedragon#4507;11-Mar-18 02:42 PM;So I kept getting shit on by level 32 mobs :HAHAHAHAHA:;;
themockingguy#6969;11-Mar-18 11:49 PM;"Question about scholar and summoner, I just got the quests for each of them and just finished the scholar one, since technically is the same class (ARC) and each job depends on the soul equiped, does that mean when you level up Scholar you also level up Summoner and vice versa?";;
lilvon#5479;12-Mar-18 12:30 AM;Thays exactly how that works;;
lilvon#5479;12-Mar-18 12:30 AM;Though youll need to still do the individual job quests to get thise Job skills.;;
themockingguy#6969;12-Mar-18 12:32 AM;"That's so cool, so even if I want to play summoner, I can play scholar as well if is needed because I already have it leveled up.";;
lilvon#5479;12-Mar-18 01:02 AM;"Basically, just make sure you do the Job quests for both or youll be missing crucial Job skills.";;
Malfred#1000;12-Mar-18 02:10 AM;Mostly your pets;;
Thelitedragon#4507;13-Mar-18 12:10 AM;">Bored, want to play XIV";;
Thelitedragon#4507;13-Mar-18 12:10 AM;Damn maintenance;;
lilvon#5479;13-Mar-18 12:13 AM;"T_T I wanted to play before work but woke up late & didnt have time between eating, doing the giveaway, & getting ready for work.";;
Thelitedragon#4507;13-Mar-18 12:15 AM;Its around 12 where I'm at;;
Thelitedragon#4507;13-Mar-18 12:15 AM;I planned to play all night because I have a lax day tomorrow but no dice :|;;
lilvon#5479;13-Mar-18 12:21 AM;Do Canadians have Spring Break?;;
Thelitedragon#4507;13-Mar-18 12:21 AM;"Yeah, it's due to start in around a week and a half";;
Thelitedragon#4507;13-Mar-18 12:22 AM;Can't wait tbh maybe then I'll pass level 30;;
Thelitedragon#4507;13-Mar-18 12:22 AM;I'm looking at the 4.25 patch notes rn and everything is for level 70 0.o;;
Thelitedragon#4507;13-Mar-18 12:22 AM;Good to know they're adding things that I can enjoy in a few years lol;;
lilvon#5479;13-Mar-18 12:23 AM;I mean theirs literlly TONS of stuff for you to do at your level.;;
lilvon#5479;13-Mar-18 12:25 AM;"Crafting, gatheirng, gold saucer,(so choco races, Triple Triad, Minion battles & all the other mini games) not to mention all the MSQ and dungeons youve still left to do.";;
Malfred#1000;13-Mar-18 12:26 AM;Level 30 is where things start opening up;;
Thelitedragon#4507;13-Mar-18 12:26 AM;Yeah I'm pretty sure I have hundreds of hours left until I can even scratch the surface of SB let alone HW;;
Malfred#1000;13-Mar-18 12:27 AM;1-30 is basically just do main quest/side quests/fates;;
Malfred#1000;13-Mar-18 12:28 AM;"30+ allows for a decent variety of dungeons to run, you get to unlock the Chocobo companion, jobs become a thing, and more";;
Malfred#1000;14-Mar-18 01:41 AM;Time to play the Forbidden Land Eureka drinking game;;
Malfred#1000;14-Mar-18 01:41 AM;Take a shot every time someone shouts EUREKA! in chat.;;
lilvon#5479;14-Mar-18 01:42 AM;Eureka opened up yesterday didnt it?;;
Malfred#1000;14-Mar-18 01:43 AM;Yes;;
