Author;Date;Content;Attachments;
!-Jisoo of the Common World-!#8403;16-May-18 12:46 PM;what kind of app is it;;
lilvon#5479;16-May-18 12:46 PM;Oh nice! I wanna hear about your app!;;
themockingguy#6969;16-May-18 12:48 PM;"It's complicated, as you know, mexico has elections very soon, Is an app for woman to feel safer and have someone monitor them. bc violence against woman candidates is very real thing that happens";;
themockingguy#6969;16-May-18 12:48 PM;And I'm making a trip to Guerrero to teach them how to use it;;
!-Jisoo of the Common World-!#8403;16-May-18 12:49 PM;you made it all by yourself or with a team?;;
!-Jisoo of the Common World-!#8403;16-May-18 12:49 PM;either way it sounds pretty cool;;
themockingguy#6969;16-May-18 12:49 PM;95% of the app and backend I did it myself;;
!-Jisoo of the Common World-!#8403;16-May-18 12:50 PM;nice;;
Thelitedragon#4507;16-May-18 12:51 PM;Did you make it using BASIC? :HAHAHAHAHA:;;
Thelitedragon#4507;16-May-18 12:51 PM;jk;;
!-Jisoo of the Common World-!#8403;16-May-18 12:51 PM;he made it in Fortran;;
!-Jisoo of the Common World-!#8403;16-May-18 12:51 PM;obv;;
themockingguy#6969;16-May-18 12:51 PM;"It's basically an app that sends the location of the user to a server in real time and the backend can only be accessed by people the candidates add, so they can see were they are at every moment";;
themockingguy#6969;16-May-18 12:52 PM;and they can send an alert if they feel unsafe;;
Thelitedragon#4507;16-May-18 12:52 PM;I made a really bad FF clone in Ti-BASIC once;;
!-Jisoo of the Common World-!#8403;16-May-18 12:52 PM;oh ok that's pretty interesting;;
!-Jisoo of the Common World-!#8403;16-May-18 12:52 PM;I need to get back into mobile dev tbh;;
!-Jisoo of the Common World-!#8403;16-May-18 12:52 PM;always wanted to do it but I'm more focused on game dev to care;;
themockingguy#6969;16-May-18 12:53 PM;"And if you must know, the app is made with React Native and the backend is Node.js and MongoDB";;
Thelitedragon#4507;16-May-18 12:53 PM;Ah! How modern;;
lilvon#5479;16-May-18 12:53 PM;Rosas the reason why the NSA can track us guys....;;
themockingguy#6969;16-May-18 12:54 PM;"Yup, I know where you are Von, I'm coming for you...";;
!-Jisoo of the Common World-!#8403;16-May-18 12:54 PM;>goes incognito;;
themockingguy#6969;16-May-18 12:54 PM;Shit;;
Thelitedragon#4507;16-May-18 12:54 PM;Foiled once again...;;
themockingguy#6969;16-May-18 12:55 PM;"Anyway, I have to make a presentation about how to use it to woman that are not very tech-savy, and I'm my public speaking skills are nor very good";;
themockingguy#6969;16-May-18 12:55 PM;and I'm having a little panic attack;;
!-Jisoo of the Common World-!#8403;16-May-18 12:56 PM;you'll be fine man;;
lilvon#5479;16-May-18 12:56 PM;No but seriously side that's *really* cool I hope you're presentation goes well!;;
Thelitedragon#4507;16-May-18 12:56 PM;Honestly if the app is that simple the interface will speak for itself!;;
Thelitedragon#4507;16-May-18 12:57 PM;"Then again, you didn't say how un-tech-savvy they were...";;
!-Jisoo of the Common World-!#8403;16-May-18 12:57 PM;think of it as if you were teaching your mother or mother figure how to use it;;
!-Jisoo of the Common World-!#8403;16-May-18 12:57 PM;that's what I'd do;;
themockingguy#6969;16-May-18 12:58 PM;I hope it goes well;;
themockingguy#6969;16-May-18 12:58 PM;"I need calm my nerves, it's all";;
!-Jisoo of the Common World-!#8403;16-May-18 12:58 PM;have you tried practicing with others;;
!-Jisoo of the Common World-!#8403;16-May-18 12:58 PM;to prepare yourself;;
!-Jisoo of the Common World-!#8403;16-May-18 12:58 PM;or even solo;;
!-Jisoo of the Common World-!#8403;16-May-18 12:59 PM;it's easier to do a presentation when you have a good idea on how you wanna go about doing it;;
!-Jisoo of the Common World-!#8403;16-May-18 12:59 PM;in my experience writing shit down doesn't help at all;;
themockingguy#6969;16-May-18 01:00 PM;"Yeah, I'm going to do that, as soon I finish my power point presentation";;
!-Jisoo of the Common World-!#8403;16-May-18 01:00 PM;"I usually forget everything I wrote when the time comes, so I focus on practicing what to say directly since that's way more reliable";;
Thelitedragon#4507;16-May-18 01:05 PM;What I do is I identify the primary things I want to get access to the audience and make sure that I word it in a way that's easy to understand;;
Thelitedragon#4507;16-May-18 01:05 PM;"This is just high school experience though, so I don't know how helpful it is";;
themockingguy#6969;16-May-18 01:09 PM;"Thanks for the tips guys, it's on friday, so plenty of time to prepare myself";;
Marcello#4574;16-May-18 01:46 PM;@themockingguy#6969 congrats man \:);;
themockingguy#6969;16-May-18 02:45 PM;Ty;;
themockingguy#6969;16-May-18 02:45 PM;I'll try to not have a nervous breakdown;;
Diabetus#1452;16-May-18 04:55 PM;Speaking of breakdowns im having one studying my history exam;;
Diabetus#1452;16-May-18 04:57 PM;I need moral support;;
Mines of Moria#4860;16-May-18 11:24 PM;@themockingguy#6969 I wish you the best of luck with your app and presentation and know you will do great.;;
Mines of Moria#4860;16-May-18 11:24 PM;@Diabetus#1452 The best solution is to keep studying and get enough rest the day of your exam. You got this.;;
themockingguy#6969;17-May-18 08:35 AM;Thank you @Mines of Moria#4860 !;;
themockingguy#6969;17-May-18 08:36 AM;I love you all!;;
lilvon#5479;18-May-18 08:44 AM;https://eu.finalfantasyxiv.com/lodestone/topics/detail/6ad6e5650c1dbba414a8c0ce4bdaa6ac12425910;;
Joie#2226;18-May-18 09:06 AM;Namazu are cute af;;
Joie#2226;18-May-18 09:07 AM;"binding notes to keys is HUGE, honestly";;
themockingguy#6969;21-May-18 02:35 PM;Happy patch day every1!;;
lilvon#5479;21-May-18 03:38 PM;Yes indeed happy patch day too all! I know for many of you this is your 1st patch day. What are we doing during the matinenece?;;
themockingguy#6969;21-May-18 03:40 PM;I will finally progress a little bit in WoFF;;
themockingguy#6969;21-May-18 03:40 PM;maybe play Rocket league with some friends;;
Thelitedragon#4507;21-May-18 03:43 PM;Meanwhile I'm here finishing my 2nd trophy play through of Persona 5 ðŸ™ƒ;;
!-Jisoo of the Common World-!#8403;21-May-18 04:10 PM;"god you just reminded me I still haven't finished the compendium, gotta get back on it one day";;
!-Jisoo of the Common World-!#8403;21-May-18 04:10 PM;I did it for the others;;
Thelitedragon#4507;21-May-18 04:27 PM;"I ran out of money to keep buying demons to fuse, and I didn't want to grind";;
Thelitedragon#4507;21-May-18 04:27 PM;"Bored today, so eh";;
Malfred#1000;21-May-18 04:44 PM;"I would play, but being in the French Alps without a computer makes it a bit tough";;
!-Jisoo of the Common World-!#8403;21-May-18 04:59 PM;@Thelitedragon#4507 you can do the pulpina strat on certain mementos mini bosses;;
!-Jisoo of the Common World-!#8403;21-May-18 05:00 PM;just make sure your persona has a high luck stat;;
themockingguy#6969;21-May-18 07:45 PM;"@lilvon#5479 when he tanks, https://www.youtube.com/watch?v=HMFX58_DCcI";;
lilvon#5479;21-May-18 08:21 PM;"Nah, its not that bad!";;
themockingguy#6969;21-May-18 08:22 PM;"I know, I'm just fucking with you";;
Mines of Moria#4860;21-May-18 09:02 PM;Im just going to watch a movie or something until I knock out which will probably be like 5 minutes into the movie.;;
lilvon#5479;22-May-18 11:16 AM;Is it bad that I spent $15 on the Yshtola set just so I could have her red bottom thigh high boots for my RDM glam?;https://cdn.discordapp.com/attachments/421131276440043537/448519455736201216/2018-05-22_10.53.29.png;
themockingguy#6969;22-May-18 11:22 AM;i'm not going to criticise you financial decisions because i make some bad choices with my money;;
themockingguy#6969;22-May-18 11:23 AM;"but.... damn, I'm not willing to spend money on glams...";;
themockingguy#6969;22-May-18 11:24 AM;but that outfit is on point ðŸ‘Œ;;
lilvon#5479;22-May-18 11:34 AM;"Ive 2 seperate RDM glamours planned, this current one im wearing as well as another set based around the Plague bringers coat";;
themockingguy#6969;22-May-18 11:58 AM;"there's so many items, I'm overwhelmed when I want to make glams";;
themockingguy#6969;22-May-18 11:58 AM;idk where to start;;
themockingguy#6969;22-May-18 12:08 PM;Damn bye road to 60 buff;https://cdn.discordapp.com/attachments/421131276440043537/448532702203871232/Screen_Shot_2018-05-22_at_12.08.24_PM.png;
Mines of Moria#4860;23-May-18 02:21 PM;It was nice while it lasted;;
themockingguy#6969;23-May-18 03:08 PM;"I read is 90 days or how long the server is preferred, whichever is longer, I logged last night and still had it, so I should be loosing it in ~10 days iirc";;
lilvon#5479;24-May-18 04:32 PM;So I decided to finally man up & play DRK in lvl 70 content since it got a host of QoL adjustments in 4.3.;;
lilvon#5479;24-May-18 04:32 PM;And HOLY HELL does it feel good! Certain improvements like adding a DRK Arts hate modifier to Plunge & additional hate on Drk Passenger make it feel sooooo good!;;
Silverx1987#9781;24-May-18 05:55 PM;Tanks are for wimps.;;
Silverx1987#9781;24-May-18 05:55 PM;*runs*;;
Joie#2226;29-May-18 01:12 PM;how is RDM now?;;
lilvon#5479;29-May-18 01:17 PM;Its still underpowered for raiding but pretty fun & GREAT for early prog. Im leveling it now and at 61 its starting to have enough going on to where its sorta interesting.;;
Carmine#9363;29-May-18 01:17 PM;SAM still #1 dps?;;
Joie#2226;29-May-18 01:17 PM;oh word. any big changes to note?;;
Joie#2226;29-May-18 01:17 PM;i remember RDM dps pretty much being just under BLM but i'm sure things have changed;;
Joie#2226;29-May-18 01:18 PM;gap opener/closer dynamics were super fun;;
Thelitedragon#4507;29-May-18 01:18 PM;I read that SAM and SMN are the best DPS?;;
Thelitedragon#4507;29-May-18 01:18 PM;Don't quote me on that;;
Carmine#9363;29-May-18 01:18 PM;probably;;
Carmine#9363;29-May-18 01:18 PM;SMN has always been close to #1;;
Joie#2226;29-May-18 01:18 PM;that sounds right;;
Carmine#9363;29-May-18 01:18 PM;fucking so much utility;;
Carmine#9363;29-May-18 01:18 PM;great AoE;;
Carmine#9363;29-May-18 01:18 PM;great single target;;
Carmine#9363;29-May-18 01:18 PM;just...ugh;;
Carmine#9363;29-May-18 01:18 PM;I think they lost Raging Strikes though;;
Carmine#9363;29-May-18 01:19 PM;._.;;
Carmine#9363;29-May-18 01:19 PM;RIP cross class rework;;
Joie#2226;29-May-18 01:20 PM;"the dot change was really weird for summoners from what i remember. made them a bit easier to play. but then again, it made just about everything easier";;
Carmine#9363;29-May-18 01:20 PM;Yea;;
Carmine#9363;29-May-18 01:20 PM;I remember the old rotation used to be;;
Carmine#9363;29-May-18 01:21 PM;Ragining Strikes -> Tri Disaster -> Contagion -> Bane -> Swiftcast -> Shadow Flare -> Blizz 2 spam;;
themockingguy#6969;29-May-18 01:21 PM;"I've been wanting to learn SMN, but damn, the rotation is like 5 minutes long";;
themockingguy#6969;29-May-18 01:22 PM;"I have the attention retention of a goldfish, no way i can remember all the things i'm supposed to do";;
Joie#2226;29-May-18 01:22 PM;"haha i think tank/healer might be better, then";;
themockingguy#6969;29-May-18 01:22 PM;"yeah, I've been playing SCH/AST/RDM";;
themockingguy#6969;29-May-18 01:23 PM;been liking AST more;;
Joie#2226;29-May-18 01:23 PM;RDM was wicked easy;;
Joie#2226;29-May-18 01:23 PM;to get like 80% optimal DPS;;
Carmine#9363;29-May-18 01:23 PM;idk;;
themockingguy#6969;29-May-18 01:23 PM;"yeah, RDM rotation is stupid easy";;
Carmine#9363;29-May-18 01:23 PM;please do not play tank;;
Joie#2226;29-May-18 01:23 PM;the rest was clever use of the gap openers to maximize;;
Carmine#9363;29-May-18 01:23 PM;if you have a short attention span;;
Carmine#9363;29-May-18 01:23 PM;you will end up being an annoying tank;;
Carmine#9363;29-May-18 01:23 PM;._.;;
Joie#2226;29-May-18 01:23 PM;tanking in FFXIV is so damn easy idk;;
Carmine#9363;29-May-18 01:23 PM;idk;;
Carmine#9363;29-May-18 01:23 PM;there's so many bad tanks;;
Carmine#9363;29-May-18 01:23 PM;if you want easy;;
Carmine#9363;29-May-18 01:23 PM;pick up a DPS imo;;
Carmine#9363;29-May-18 01:24 PM;there's a lot of nuances to tanking that people don't get;;
themockingguy#6969;29-May-18 01:24 PM;"Yeah, maybe some day i'll learn to tank";;
themockingguy#6969;29-May-18 01:24 PM;not soon;;
Carmine#9363;29-May-18 01:24 PM;like they just stay in Shield Oath 100% of the fight and their DPS is shit;;
Carmine#9363;29-May-18 01:24 PM;or they don't pop or save cooldowns at the right times;;
Carmine#9363;29-May-18 01:24 PM;and force the healers to do twice as much work and waste their MP;;
Joie#2226;29-May-18 01:24 PM;"it's definitely easier and less stressful to play DPS at entry-level compared to the other two, but playing a DPS in XIV is like playing a spreadsheet at times";;
Carmine#9363;29-May-18 01:24 PM;the thing is;;
Carmine#9363;29-May-18 01:25 PM;as a tank you still need to worry about a DPS rotation;;
Carmine#9363;29-May-18 01:25 PM;on top of worrying about tank mechanics and stance dancing;;
Joie#2226;29-May-18 01:25 PM;this is true;;
Carmine#9363;29-May-18 01:25 PM;and our rotations isn't much easier than a standard dps rotation;;
Joie#2226;29-May-18 01:25 PM;but tank dps rotations are super easy to pick up;;
themockingguy#6969;29-May-18 01:25 PM;"I like playing healer,  but I prefer to learn a DPS properly, i need to learn SMN";;
Carmine#9363;29-May-18 01:25 PM;"we have our AoE rotation, our single target rotation";;
Carmine#9363;29-May-18 01:25 PM;and our aggro rotation;;
themockingguy#6969;29-May-18 01:25 PM;but healer queues are so much faster than DPS queues;;
Carmine#9363;29-May-18 01:25 PM;tank queues are fast too;;
Carmine#9363;29-May-18 01:25 PM;that's why I played tank;;
Carmine#9363;29-May-18 01:25 PM;that and I was tired of bad tanks;;
Joie#2226;29-May-18 01:26 PM;tank/healer queues were instantaneous when i last played;;
Carmine#9363;29-May-18 01:26 PM;because it just seems like people are stuck in the mentality that tanks shouldn't ever use offensice stance unless they're soloing;;
Carmine#9363;29-May-18 01:26 PM;";v";;
Joie#2226;29-May-18 01:26 PM;i made so much gil queueing people for DF lmao;;
themockingguy#6969;29-May-18 01:26 PM;"yeah, the longest i had to wait for a healer queue was 5 minutes";;
Joie#2226;29-May-18 01:26 PM;i think only really bad players or people super new to XIV think that;;
Carmine#9363;29-May-18 01:27 PM;offensive*;;
Joie#2226;29-May-18 01:28 PM;haha but i've definitely had people chastise me for casting stone because they dont understand that you dont have to spam heal people in that game;;
Joie#2226;29-May-18 01:28 PM;so frustrating;;
Joie#2226;29-May-18 01:29 PM;"first and foremost is learning your role and doing that effectively, but the game is designed so that is super easy to pick up";;
themockingguy#6969;29-May-18 01:29 PM;"I'm the oposite, sometimes i'm to focused on my DPS that i forget to heal the tank ðŸ˜‚";;
Joie#2226;29-May-18 01:29 PM;"hey, it happens to everyone at least once";;
themockingguy#6969;29-May-18 01:29 PM;"only had one tank die tho, usually im quick on the emergency heals";;
themockingguy#6969;29-May-18 01:30 PM;and as AST I always leave lightspeed for such an ocations;;
Carmine#9363;29-May-18 01:30 PM;Healer is the worst;;
Carmine#9363;29-May-18 01:30 PM;Healing > Tanking > DPSing;;
Carmine#9363;29-May-18 01:30 PM;"Because as a Healer you have to worry about your aggro, you have to worry about your MP, you have to worry about people standing in stupid, you have to worry about your DPS, you have to worry about your overhealing";;
Carmine#9363;29-May-18 01:31 PM;DPS is just;;
Joie#2226;29-May-18 01:31 PM;"it takes some practice and knowledge of fights to know just HOW much leeway you're given as a healer, but i think in casual content it's pretty intuitive";;
Carmine#9363;29-May-18 01:31 PM;IS MY ROTATION BEING OPTIMIZED;;
themockingguy#6969;29-May-18 01:31 PM;"I hate the mana managment of AST, if you are unlucky and dont get bole, your fucked";;
Carmine#9363;29-May-18 01:31 PM;and the same mechanics that everyone else already has to deal with;;
Joie#2226;29-May-18 01:31 PM;"in theory, yeah.XIV spells are enormously potent for the genre";;
Carmine#9363;29-May-18 01:31 PM;healing raid content looks stressful;;
Carmine#9363;29-May-18 01:31 PM;but my friend is a server all-star;;
Carmine#9363;29-May-18 01:31 PM;and one of the best WHM in NA;;
Carmine#9363;29-May-18 01:31 PM;"so watching him, everything looks easy";;
Carmine#9363;29-May-18 01:32 PM;=_=;;
lilvon#5479;29-May-18 01:32 PM;Been leveling DRK recently havent quite got to the point where I can take it into endgame contents yet but tanking end game dungeons has been pretty fun.;;
Joie#2226;29-May-18 01:32 PM;mouseover healer macros also make things wicked easy if you can get used to them;;
Joie#2226;29-May-18 01:32 PM;DRK is a blast;;
Joie#2226;29-May-18 01:32 PM;i love how technical it is;;
Carmine#9363;29-May-18 01:33 PM;dfw I play on controller;;
Joie#2226;29-May-18 01:33 PM;wuttt;;
Joie#2226;29-May-18 01:33 PM;i've never understood that;;
Carmine#9363;29-May-18 01:33 PM;end-game raid tank that uses a controller;;
Carmine#9363;29-May-18 01:33 PM;B^);;
Carmine#9363;29-May-18 01:33 PM;still doing massive DPS and all the mechanics just fine;;
lilvon#5479;29-May-18 01:33 PM;"Yeah balancing gauge, MP, aggro, and stance dancing is fun.";;
Carmine#9363;29-May-18 01:33 PM;the game is actually really optimized for controller;;
Joie#2226;29-May-18 01:33 PM;"i can see tank and dps on a controller maybe, but healing on a controller is just way too much effort for the result";;
Carmine#9363;29-May-18 01:34 PM;I don't need mouse over macros for healing;;
lilvon#5479;29-May-18 01:34 PM;It also got a bunch of QoL improvments recently.f;;
themockingguy#6969;29-May-18 01:34 PM;it's good on controller actually;;
Joie#2226;29-May-18 01:34 PM;"idk it's obviously a preference thing, but i just find targeting so much easier with mouse/kb";;
lilvon#5479;29-May-18 01:34 PM;I raided with Sch on PS4 using a controller is fine for healing;;
Joie#2226;29-May-18 01:35 PM;"in terms of efficiency, i dont think a controller compares, but YMMV";;
Carmine#9363;29-May-18 01:35 PM;I like being kicked back while tanking B^);;
Joie#2226;29-May-18 01:37 PM;"like, having to put down the controller or maneuver it to the side to type or use a command is annoying";;
Joie#2226;29-May-18 01:37 PM;just grates me;;
lilvon#5479;29-May-18 01:39 PM;I mean a keyboard will always be better because it has more inputs;;
lilvon#5479;29-May-18 01:39 PM;But I don't think usin a controller will hold you back as far as combat goes;;
Joie#2226;29-May-18 01:40 PM;"as a whole, probably not";;
Carmine#9363;29-May-18 01:41 PM;idk;;
Carmine#9363;29-May-18 01:41 PM;with how controller hotbars work;;
Carmine#9363;29-May-18 01:41 PM;there literally aren't enough things for me to use to fill all the hotbars;;
Carmine#9363;29-May-18 01:41 PM;I think I actually have equal or more hotkeys than a keyboard player?;;
Joie#2226;29-May-18 01:41 PM;"especially if you prefer it mechanically. and if a controller works better and allows you to still clear the content you want to clear and perform at an acceptable level, then it doesn't really matter. but in terms of efficiency, i dont think its possible to beat a mouse and keyboard";;
Joie#2226;29-May-18 01:42 PM;no way;;
Joie#2226;29-May-18 01:42 PM;alt + shift + ctrl are all modifiers;;
Carmine#9363;29-May-18 01:42 PM;"8 hotkeys per row, and";;
!-Jisoo of the Common World-!#8403;29-May-18 01:42 PM;you can't but tbh if you didn't grow up using that style it's gonna be hard to shift;;
Carmine#9363;29-May-18 01:42 PM;There are 8 different rows;;
Carmine#9363;29-May-18 01:42 PM;so I can have 64 hotkeys?;;
Joie#2226;29-May-18 01:42 PM;"not to mention F keys, mouse keys, and even multiple modifiers (like if you wanted to do alt+shift+1)";;
Carmine#9363;29-May-18 01:42 PM;that would be a pain in the ass;;
Carmine#9363;29-May-18 01:42 PM;to press 3 keys down to get one skill out <_<;;
Joie#2226;29-May-18 01:43 PM;you dont ever have to do that;;
Carmine#9363;29-May-18 01:43 PM;all I have to do is hold down a trigger button and press a directional button;;
Carmine#9363;29-May-18 01:43 PM;or a non dpad button;;
Carmine#9363;29-May-18 01:43 PM;whatever the non dpad buttons are called;;
Carmine#9363;29-May-18 01:43 PM;buttons?;;
!-Jisoo of the Common World-!#8403;29-May-18 01:43 PM;face buttons;;
Carmine#9363;29-May-18 01:43 PM;XABY buttons whatever;;
Joie#2226;29-May-18 01:43 PM;i dont use more than 2 inputs except for commands that actually control the screen;;
Joie#2226;29-May-18 01:44 PM;like brightness or something;;
Joie#2226;29-May-18 01:45 PM;"i mostly use 1-6, Q-Y, A-H, Z-B, and either alt, shift, or ctrl modifiers for those keys";;
Joie#2226;29-May-18 01:45 PM;with healing it's even less because i use mouseover macros;;
lilvon#5479;07-Jun-18 05:54 PM;Hows everyone enjoying the Gold Saucer Make it Rain event?;;
lilvon#5479;07-Jun-18 05:55 PM;Ill be keeping the Jackpot2 buff up for the duration of the event to increase the MGP payouts to 60%!;;
themockingguy#6969;07-Jun-18 06:00 PM;I havet been able to log in yet;;
themockingguy#6969;07-Jun-18 06:00 PM;"I'll do later, I want the bunny outfit";;
themockingguy#6969;07-Jun-18 06:00 PM;so i can annoy everyone with it;;
Baguette Cat#6233;07-Jun-18 06:00 PM;Can I join in even if I'm not part of the FC?;;
Baguette Cat#6233;07-Jun-18 06:00 PM;"Join in that chat, I mean";;
themockingguy#6969;07-Jun-18 06:01 PM;"You're welcome to!, I think @lilvon#5479 was going to set up a linkshell for it";;
Baguette Cat#6233;07-Jun-18 06:03 PM;It's just that I'm on Phoenix but at least I play FFXIV a lot;;
Baguette Cat#6233;07-Jun-18 06:03 PM;And I just finished the last chocobo race;;
lilvon#5479;07-Jun-18 06:06 PM;Yeah ill hop on the LS... eventually;;
Baguette Cat#6233;07-Jun-18 06:06 PM;"And I'm done for the night, I need my sleep (1 am in France). Good night.";;
themockingguy#6969;07-Jun-18 06:09 PM;Night!;;
themockingguy#6969;07-Jun-18 09:01 PM;"I love the localization team., , A quest is called Courage the cowardly lupin";;
themockingguy#6969;09-Jun-18 04:41 PM;"Im online, if someone wishes to join me";;
lilvon#5479;09-Jun-18 04:45 PM;Ill be on soon. Just got off.;;
themockingguy#6969;09-Jun-18 05:17 PM;:yeah:;;
lilvon#5479;09-Jun-18 05:22 PM;Lol nvm people keep texting me to do things. Might be a while.;;
lilvon#5479;09-Jun-18 05:29 PM;Nvm to my nvm just realized i dont have the gas to go anywhere but home lol!;;
lilvon#5479;14-Jun-18 06:14 PM;;https://cdn.discordapp.com/attachments/421131276440043537/456959631063908362/35241402_1788359037897709_2466612989541744640_o-1.jpg,https://cdn.discordapp.com/attachments/421131276440043537/456959631663562752/2018-06-14_17.23.08.png;
lilvon#5479;14-Jun-18 06:14 PM;Got RDM to 70 and finalized its glamour;;
lilvon#5479;14-Jun-18 06:14 PM;Model viewer pics because I dont actually have the hat yet. Thatll take at least another week or 2;;
Baguette Cat#6233;14-Jun-18 06:20 PM;"Get on my level, scrub ! :HAHAHAHAHA:";https://cdn.discordapp.com/attachments/421131276440043537/456961266267979786/ffxiv_dx11_2018-06-15_01-19-21-07.jpg;
Baguette Cat#6233;14-Jun-18 06:20 PM;;https://cdn.discordapp.com/attachments/421131276440043537/456961279379374090/ffxiv_dx11_2018-06-15_01-19-23-70.jpg;
Baguette Cat#6233;14-Jun-18 06:21 PM;"(I'm kidding, yours is nice too)";;
lilvon#5479;14-Jun-18 07:32 PM;I LOVE the chicken knife!  Will need to make *another* alt glam to incorporate it somehow!;;
Baguette Cat#6233;15-Jun-18 05:01 AM;"The glamour something can save 10 sets, and you only need to be in a big city to change it prism free";;
themockingguy#6969;15-Jun-18 11:19 PM;@lilvon#5479 I cleared Stormblood!!!;;
themockingguy#6969;15-Jun-18 11:19 PM;"I also went and got the omega raids, ranabaste, and eureka";;
themockingguy#6969;15-Jun-18 11:19 PM;And a bunch of ex primals;;
lilvon#5479;15-Jun-18 11:30 PM;Noice!;;
lilvon#5479;15-Jun-18 11:33 PM;Dont work tomorrow so im down for whatever.;;
Thelitedragon#4507;16-Jun-18 08:31 PM;Ah crap my sub didn't go through;;
Thelitedragon#4507;16-Jun-18 08:31 PM;"I wonder if I'm able to play when I'm in China, cuz I know for a fact that I'd be hella bored there";;
themockingguy#6969;16-Jun-18 11:00 PM;You're going to China?;;
themockingguy#6969;16-Jun-18 11:01 PM;"Also, I went out with some friends, so I didn't get a chance to log in today";;
Thelitedragon#4507;16-Jun-18 11:36 PM;"Yeah, for meeting up with relatives and whatever";;
Thelitedragon#4507;16-Jun-18 11:36 PM;I just want to grab some cheap computer stuff;;
themockingguy#6969;17-Jun-18 12:02 AM;"Oh cool, I hope you can log in china, so I can help you clear stuffs.";;
lilvon#5479;17-Jun-18 12:23 PM;Just now realizing I didnt post it here but Im taking a small break from FFXIV.;;
lilvon#5479;17-Jun-18 12:25 PM;I attempted to log yesterday morning & my sub ran out. I get my 1st paycheck Tuesday but I think im gonna give myself a week off to play the new god of war.;;
lilvon#5479;17-Jun-18 12:26 PM;"I had borrowed it from a friend, played it for an hour, realized I hated the controls & put it down for a month lol";;
Mines of Moria#4860;17-Jun-18 07:49 PM;"Lol, I was about to post the opposite in that I hope I'm actually finally to play consistently again instead of only once a week like I have been lately. I hope you enjoy God of War. I want to play it soon too.";;
!-Jisoo of the Common World-!#8403;17-Jun-18 07:49 PM;great game;;
!-Jisoo of the Common World-!#8403;17-Jun-18 07:50 PM;I sold my copy to a friend a couple of weeks ago so he could play it;;
themockingguy#6969;17-Jun-18 07:52 PM;I've been in a nostalgia trip and have been playing Halo.;;
lilvon#5479;17-Jun-18 08:03 PM;God of War is a good game. It would be GREAT of the controls wernt ass.;;
Mines of Moria#4860;17-Jun-18 08:15 PM;What's so ass about the controlls?;;
