Author;Date;Content;Attachments;
Baguette Cat#6233;08-Sep-18 08:28 AM;Liraya Bestkitty is the name of my character in FF14;;
Deleted User#0000;08-Sep-18 11:38 AM;Oh ok;;
Baguette Cat#6233;08-Sep-18 12:14 PM;It sounded more aggressive than I wanted;;
Baguette Cat#6233;08-Sep-18 12:15 PM;Sorry;;
Thelitedragon#4507;08-Sep-18 12:31 PM;I wonder what the next expansion will be :HAHAHAHAHA:;;
Thelitedragon#4507;08-Sep-18 12:31 PM;New jobs :LUVLUVLUVLUVLUV:;;
Baguette Cat#6233;08-Sep-18 12:36 PM;"Blue Mage, Dancer and Puppeteer";;
Thelitedragon#4507;08-Sep-18 12:37 PM;Shit I'd go for Dancer;;
Thelitedragon#4507;08-Sep-18 12:37 PM;But I bet 70-80 is going to be a goddamn crapshoot;;
Left Side Worldwide#6969;08-Sep-18 02:49 PM;"Leaks have confirmed it is Blue Mage, Dancer, Gunblader";;
Left Side Worldwide#6969;08-Sep-18 02:49 PM;"DPS, Healer, Tank respectively";;
Left Side Worldwide#6969;08-Sep-18 02:49 PM;Take it with a grain of salt but he's been 100% on the money so far;;
Baguette Cat#6233;08-Sep-18 04:12 PM;Gunblader;;
Baguette Cat#6233;08-Sep-18 04:12 PM;"Like, Corsair but more fanservicy?";;
Left Side Worldwide#6969;08-Sep-18 06:58 PM;Â¯\_(ãƒ„)_/Â¯;;
themockingguy#6969;08-Sep-18 09:13 PM;I just got my byakko and Susano doggos in my 6th and 2nd clear today respectively;;
themockingguy#6969;08-Sep-18 09:14 PM;Watch me not get another doggo in my life;;
Thelitedragon#4507;08-Sep-18 10:11 PM;finally;;
Thelitedragon#4507;08-Sep-18 10:11 PM;aether compass;;
Thelitedragon#4507;09-Sep-18 02:48 AM;"wow, 7 hours straight of XIV";;
Thelitedragon#4507;09-Sep-18 02:48 AM;my eyes;;
Thelitedragon#4507;09-Sep-18 02:48 AM;they hurt;;
Malfred#1000;09-Sep-18 03:47 AM;"Gunblader would likely be a Garlean class, so I doubt it'd anything like Corsair";;
Malfred#1000;09-Sep-18 03:50 AM;Blue Mage was hinted during the Rising event prior to SBs reveal alongside Red Mage and Samurai.. So that one is basically guaranteed;;
Malfred#1000;09-Sep-18 03:51 AM;"Dancer seems to have been popular evner since SBs intro was first revealed, both among fans and devs, so that's another safe bet";;
Malfred#1000;09-Sep-18 03:54 AM;"Gunblades have been a popular request since 1.0.. So it'd make sense.. Although that would also imply us reaching Garlemald, which seems a bit too soon";;
Left Side Worldwide#6969;09-Sep-18 04:14 AM;There is no way we aren't going to garlemald next xpac;;
Left Side Worldwide#6969;09-Sep-18 04:14 AM;Alphinaud is literally in Garlemald right now;;
Left Side Worldwide#6969;09-Sep-18 04:15 AM;Ascians are causing havoc in the Garlean hierarchy which is threatening Doma and Eorzea;;
Left Side Worldwide#6969;09-Sep-18 04:15 AM;We gotta go stop them;;
Left Side Worldwide#6969;09-Sep-18 04:16 AM;And if I am wrong then I will go to your house and shit in your toilet;;
Malfred#1000;09-Sep-18 05:24 AM;That's going to cost you quite a lot;;
Malfred#1000;09-Sep-18 05:24 AM;Trans-atlantic flights aren't cheap;;
Thelitedragon#4507;09-Sep-18 06:22 PM;@themockingguy#6969;;
Thelitedragon#4507;09-Sep-18 06:22 PM;I dced again lol;;
Thelitedragon#4507;09-Sep-18 06:22 PM;I didn't catch what you said after NIN get;;
Thelitedragon#4507;09-Sep-18 09:36 PM;@lilvon#5479;;
Thelitedragon#4507;09-Sep-18 09:36 PM;when are we gonna haz airship;;
hot boy#6161;09-Sep-18 10:21 PM;u guys are in aether right;;
hot boy#6161;09-Sep-18 10:21 PM;not primal;;
Thelitedragon#4507;09-Sep-18 10:34 PM;Yeah aether;;
lilvon#5479;10-Sep-18 12:04 AM;Weve had an airship for.... like 2+ years now?;;
Thelitedragon#4507;10-Sep-18 12:14 AM;hm;;
Thelitedragon#4507;10-Sep-18 12:14 AM;HM;;
Thelitedragon#4507;10-Sep-18 12:14 AM;I bet you're gonna be really proud of my progress when you finally log back in;;
Thelitedragon#4507;10-Sep-18 12:15 AM;I think the last time I saw you in game I was doing fuck all trying to finish the end of ARR lol;;
FireProne#0537;10-Sep-18 12:44 AM;I'm downloading a realm reborn I hope I can run it;;
lilvon#5479;10-Sep-18 12:56 AM;Yeah. Ill be back on sometime later this week. Get paid tomorrow and need to log before the rising event ends on the 16th.;;
lilvon#5479;10-Sep-18 12:57 AM;"@FireProne#0537  be sure to join us on Aether datacenter, siren server.";;
FireProne#0537;10-Sep-18 01:57 AM;you have to have a controller to play?;;
Thelitedragon#4507;10-Sep-18 02:09 AM;Controller or keyboard and mouse;;
FireProne#0537;10-Sep-18 02:13 AM;oh ok well I can only use keyboard and mouse so when I get in game I can use wasd to move and stuff?;;
FireProne#0537;10-Sep-18 02:15 AM;oh man these graphics are so good;;
Thelitedragon#4507;10-Sep-18 02:22 AM;Yep;;
Thelitedragon#4507;10-Sep-18 02:22 AM;You'll get a feel for it;;
Thelitedragon#4507;10-Sep-18 02:23 AM;"If you're on Aether datacenter and Siren world, I can probably add you to our Free Company maybe tomorrow evening";;
FireProne#0537;10-Sep-18 04:21 AM;"So far I'm enjoying it, I just wonder if there is a way to mark a waypoint so I don't have to keep pulling up the map every time.";;
Left Side Worldwide#6969;10-Sep-18 04:48 AM;"No, but eventually you just kinda learn the maps";;
themockingguy#6969;10-Sep-18 01:59 PM;;https://cdn.discordapp.com/attachments/421131276440043537/488785583590604801/parzqdtwxfl11.png;
Thelitedragon#4507;10-Sep-18 02:25 PM;Shinji you didn't need to attack me like that;;
themockingguy#6969;10-Sep-18 02:44 PM;"This was never intended specifically for you, if the boot fits I guess";;
Thelitedragon#4507;10-Sep-18 02:46 PM;"This was exactly what that guy criticised me for yesterday, so I got triggered ðŸ™ƒ";;
lilvon#5479;10-Sep-18 02:52 PM;As a sch main I can assure you that if this is how you play then youre doing nothing wrong!;;
themockingguy#6969;10-Sep-18 02:55 PM;"Yeah, I know, he was telling me yesterday that some guys while runing Raumh flamed him for DPSing and not heaing";;
Thelitedragon#4507;10-Sep-18 02:55 PM;You were casting broil with 1500 mana while 4 people were dead;;
themockingguy#6969;10-Sep-18 02:55 PM;"when half the party was dead, and him out of mana";;
Thelitedragon#4507;10-Sep-18 02:55 PM;you don't have to lie to make yourself look better LOL;;
Thelitedragon#4507;10-Sep-18 02:55 PM;I had enough mana;;
Thelitedragon#4507;10-Sep-18 02:55 PM;But not a big enough window to rez because you know;;
Thelitedragon#4507;10-Sep-18 02:55 PM;The tanks were gonna fucking die because the other healer was dead;;
lilvon#5479;10-Sep-18 02:55 PM;I see no problem here!;;
Thelitedragon#4507;10-Sep-18 02:56 PM;I see now that I couldve casted a broil and then quickcast a rez;;
FireProne#0537;10-Sep-18 03:17 PM;Is there a way to pay for a whole year or do I have to pay monthly?;;
themockingguy#6969;10-Sep-18 03:20 PM;"you can pay  the standard sub in 30, 90 and 180 day increments, not the whole year";;
FireProne#0537;10-Sep-18 03:24 PM;"increments? So say I wanted the 180 days, does it cost the same with the 30 and 90 days?";;
themockingguy#6969;10-Sep-18 03:25 PM;"You get a slight discount, idk how much tho";;
themockingguy#6969;10-Sep-18 03:34 PM;@FireProne#0537;https://cdn.discordapp.com/attachments/421131276440043537/488809477471207453/Screen_Shot_2018-09-10_at_3.33.31_PM.png;
Left Side Worldwide#6969;10-Sep-18 07:46 PM;But you can only have 180 days worth of sub at a time;;
Left Side Worldwide#6969;10-Sep-18 07:46 PM;Why? I dunno.;;
Thelitedragon#4507;10-Sep-18 07:47 PM;/shrug;;
Thelitedragon#4507;10-Sep-18 09:52 PM;guess I should do my rounds before I start studying;;
hot boy#6161;10-Sep-18 11:14 PM;this game has like side questlines right?;;
hot boy#6161;10-Sep-18 11:14 PM;like runescape has?;;
hot boy#6161;10-Sep-18 11:14 PM;most side quests i have found are just like fetch quests and shit;;
hot boy#6161;10-Sep-18 11:15 PM;or go kill the monster quests;;
Thelitedragon#4507;10-Sep-18 11:24 PM;It has some yeah;;
Thelitedragon#4507;10-Sep-18 11:24 PM;Later on though;;
FireProne#0537;11-Sep-18 12:18 AM;"leve quests are good too, I just unlocked that a bit ago.";;
lilvon#5479;11-Sep-18 01:36 PM;@themockingguy#6969  or @Thelitedragon#4507  at yalls earliest convineance I need you to get Splackavellie Ve'nior added to the FC!;;
Thelitedragon#4507;11-Sep-18 01:47 PM;I'll grab it in like 4 hrs if Shinji isn't able;;
Thelitedragon#4507;11-Sep-18 01:47 PM;At school;;
themockingguy#6969;11-Sep-18 04:41 PM;"I'm like 300km from home,Joker might be the first";;
Thelitedragon#4507;11-Sep-18 05:35 PM;...maybe;;
Thelitedragon#4507;11-Sep-18 07:17 PM;Can't find em @lilvon#5479;;
Thelitedragon#4507;11-Sep-18 07:18 PM;Are you sure they're on the right datacenter/world?;;
Thelitedragon#4507;11-Sep-18 07:25 PM;nvm found them on the Lodestone;;
Thelitedragon#4507;11-Sep-18 07:25 PM;not in game though for some reason;;
Thelitedragon#4507;11-Sep-18 07:25 PM;The player search in game is pretty bad;;
Thelitedragon#4507;11-Sep-18 07:29 PM;"Oh, only finds people who are online";;
Thelitedragon#4507;11-Sep-18 07:30 PM;https://na.finalfantasyxiv.com/lodestone/character/22137578/;;
Thelitedragon#4507;11-Sep-18 07:30 PM;This our man?;;
lilvon#5479;11-Sep-18 11:51 PM;Sorry. Just now getting hime from work.;;
lilvon#5479;11-Sep-18 11:51 PM;"Yeah thats him, he said he  .  Put in an app.";;
Thelitedragon#4507;11-Sep-18 11:52 PM;"Oh, I'll log for a second to see if I can help him out";;
lilvon#5479;11-Sep-18 11:54 PM;Ill re-up my sub tomorrow when I cash my check.;;
Thelitedragon#4507;11-Sep-18 11:55 PM;alright;;
Thelitedragon#4507;11-Sep-18 11:55 PM;I accepted the thingy!;;
lilvon#5479;12-Sep-18 10:53 AM;Dope! Yy!;;
FireProne#0537;12-Sep-18 11:24 PM;How many characters can you have per world if you're subscribed?;;
Left Side Worldwide#6969;13-Sep-18 12:57 AM;Depends on your subscription level;;
Left Side Worldwide#6969;13-Sep-18 12:57 AM;"Entry can have 1 per world, 8 in total";;
Left Side Worldwide#6969;13-Sep-18 12:57 AM;"Standard gets 8 per world, 40 total";;
Left Side Worldwide#6969;13-Sep-18 12:57 AM;Almost everyone does entry so dw about it;;
FireProne#0537;13-Sep-18 01:14 AM;"Oh I see well that's kind of lame since I wanted to play an elezen mage on the same world my gladiator is on, but I heard you can play any class on 1 character so I guess I can just switch roles on the same character if that's possible.";;
Malfred#1000;13-Sep-18 01:15 AM;It is;;
Thelitedragon#4507;13-Sep-18 01:15 AM;"Yeah, it's not like some other MMOs where you're stuck on a single class forever";;
Thelitedragon#4507;13-Sep-18 01:15 AM;"In fact, you can freely switch like.. whenever you want to be honest";;
Malfred#1000;13-Sep-18 01:16 AM;Just unlock the class by doing a small quest for the receptionist in said class' guild;;
Thelitedragon#4507;13-Sep-18 01:16 AM;I think you unlock that functionality when you beat the level 15 quest for your 1st class;;
Malfred#1000;13-Sep-18 01:17 AM;Then you can swap by equipping the weapon relevant to the class;;
Malfred#1000;13-Sep-18 01:17 AM;"Seems about right, yeah";;
Malfred#1000;13-Sep-18 01:17 AM;10 or 15;;
FireProne#0537;13-Sep-18 01:18 AM;Oh I see well then if I swap with the weapon would it automatically change the armor too?;;
Malfred#1000;13-Sep-18 01:18 AM;No;;
Thelitedragon#4507;13-Sep-18 01:18 AM;You need to get separate armor specific for the class that you are using;;
Thelitedragon#4507;13-Sep-18 01:19 AM;"A white mage can't equip a paladin's armor, for example";;
FireProne#0537;13-Sep-18 01:19 AM;So basically I'd have to change it one by one;;
Malfred#1000;13-Sep-18 01:19 AM;It will just unequip anything you can't wear as the new class;;
Thelitedragon#4507;13-Sep-18 01:19 AM;There's an automatic equip function;;
Thelitedragon#4507;13-Sep-18 01:19 AM;It equips the best armor that possible;;
Malfred#1000;13-Sep-18 01:19 AM;You can also create class loadouts;;
Malfred#1000;13-Sep-18 01:21 AM;"Every time you unlock a new class, be they DoW/DoM, DoH, or DoL, it will also unlock an extra loadout slot";;
Thelitedragon#4507;13-Sep-18 01:23 AM;"Disciple of War/Magic, Hand, Land, btw if you don't know";;
FireProne#0537;13-Sep-18 01:23 AM;Oh that's good then;;
FireProne#0537;13-Sep-18 01:23 AM;then that means I can just switch slots instead of having to re-equip everything;;
Thelitedragon#4507;13-Sep-18 01:23 AM;"Yeah, basically";;
Thelitedragon#4507;13-Sep-18 01:24 AM;That's what I do when I change from Dark Knight to Scholar;;
Malfred#1000;13-Sep-18 01:24 AM;I personally have a loadout for each class;;
Malfred#1000;13-Sep-18 01:25 AM;... But i've also players for a loooooong time;;
FireProne#0537;13-Sep-18 01:25 AM;Also if I buy the full game would it come with a free 30 day sub or would I have to buy the game and then pay the sub?;;
Thelitedragon#4507;13-Sep-18 01:26 AM;Its a pain in the ass to organise all of those loadouts;;
Thelitedragon#4507;13-Sep-18 01:26 AM;The sorting system for loadouts is only manual;;
themockingguy#6969;13-Sep-18 01:33 AM;You can assign them to a hotbar for quick access;;
themockingguy#6969;13-Sep-18 01:33 AM;I have them on one of my hotbars actually;;
Caius#6568;13-Sep-18 01:41 AM;"Highly recommend you set them to a hotbar. If you use controller use one of the later ones that people usually fill with emotes lol (6,7+8)";;
Left Side Worldwide#6969;13-Sep-18 11:30 AM;"@FireProne#0537 Yes, they give you 30 days for free as well as 15 free days for reaching Lv30 for the first time on a data center I believe";;
Left Side Worldwide#6969;13-Sep-18 11:31 AM;"@FireProne#0537 And also, if you would prefer to be an Elezen, when you pay for your first 30 days you get a Fantasia for free, and you also get one for free when you complete the Main Story of 2.0 content.";;
themockingguy#6969;13-Sep-18 11:50 AM;The 15 free days are if you get to lvl 30 in a preferred server;;
Left Side Worldwide#6969;13-Sep-18 12:27 PM;Oh right;;
MajorBroski#8359;13-Sep-18 03:05 PM;I need to get back at this game.;;
Left Side Worldwide#6969;13-Sep-18 04:36 PM;Same;;
FireProne#0537;13-Sep-18 05:06 PM;"Oh ok then that's cool, what if I reached level 35 max cap on the free trial? Since I bought the game will I be able to continue where I left off?";;
Thelitedragon#4507;13-Sep-18 05:40 PM;Yeah;;
Left Side Worldwide#6969;13-Sep-18 07:46 PM;"@FireProne#0537 Buying the game and linking the code will simply set a flag on your account that says Access to ARR/HW/SB or whatever level you have, and gives you access to the appropriate services.";;
ArchmageDirty#0374;13-Sep-18 08:12 PM;hey peeps;;
lilvon#5479;13-Sep-18 09:19 PM;Hi!;;
MajorBroski#8359;14-Sep-18 12:49 AM;https://www.humblebundle.com/store/final-fantasy-14-online-complete-edition?hmb_source=humble_home&hmb_medium=product_tile&hmb_campaign=mosaic_section_2_layout_index_13_layout_type_threes_tile_index_3;;
MajorBroski#8359;14-Sep-18 12:49 AM;Just to let yall know;;
Caius#6568;14-Sep-18 04:56 AM;https://na.finalfantasyxiv.com/lodestone/topics/detail/9b217677daf859702c5df3505060e8f3437fc55a;;
themockingguy#6969;14-Sep-18 11:43 AM;"```, The means for obtaining items required to proceed in the quest Legacy of Allag has been changed., ```";;
themockingguy#6969;14-Sep-18 11:43 AM;"Thank god, newbies doesn't have to do those stupid FATES to get the Crystal tower raids";;
themockingguy#6969;14-Sep-18 11:54 AM;@Thelitedragon#4507 There are going to be even more instruments now;https://cdn.discordapp.com/attachments/421131276440043537/490203683808608256/Screen_Shot_2018-09-14_at_11.53.48_AM.png;
Thelitedragon#4507;14-Sep-18 12:02 PM;Lol what;;
Thelitedragon#4507;14-Sep-18 12:02 PM;I wonder how they're gonna manage that one;;
hot boy#6161;14-Sep-18 01:57 PM;uh when do quests actually start giving dragoon armor;;
hot boy#6161;14-Sep-18 01:57 PM;every story quest just gives mage and tank armor no dragoon armor;;
themockingguy#6969;14-Sep-18 02:00 PM;"They do give melee DPS armor, they group the Melee DPS with the tanks for some reason, it should say Disciples of War";;
themockingguy#6969;14-Sep-18 02:00 PM;"They can be worn by DPS and tanks, but some have Tank stats and other have DPS stats";;
themockingguy#6969;14-Sep-18 02:01 PM;"I wuoldn't worry at lower levels thta much, just grab all the gear that says  Disciples of War";;
themockingguy#6969;14-Sep-18 02:01 PM;And the auto-equip should put it if it's correct for you class;;
hot boy#6161;14-Sep-18 02:16 PM;i mean tanks get like actual armor and dragoons cant wear any of it;;
hot boy#6161;14-Sep-18 02:17 PM;the option they give us is woolen/hempen shirt and pants every quest;;
hot boy#6161;14-Sep-18 02:17 PM;the tanks they get like new gear every time;;
hot boy#6161;14-Sep-18 02:17 PM;then dragoon gets another woolen shirt with slightly higher stats lol;;
hot boy#6161;14-Sep-18 02:18 PM;"we dont get actual armor, even tho i know the armor exists";;
hot boy#6161;14-Sep-18 02:18 PM;cause ive seen it in market board;;
Left Side Worldwide#6969;14-Sep-18 02:19 PM;For now just start wearing DoW armor because it really doesn't matter;;
Thelitedragon#4507;14-Sep-18 03:52 PM;The MSQ doesn't really give you the best gear;;
Thelitedragon#4507;14-Sep-18 03:53 PM;If you want it then grab it from the market board at 1000x markup;;
Thelitedragon#4507;14-Sep-18 03:53 PM;But honestly just play through until you finish the MSQ and then you'll get some nice gear;;
hot boy#6161;14-Sep-18 08:16 PM;Like I just did a dungeon and our tank got a whole new set of armor out of it lol.;;
Thelitedragon#4507;14-Sep-18 08:16 PM;what;;
Thelitedragon#4507;14-Sep-18 08:16 PM;I want that;;
hot boy#6161;14-Sep-18 08:16 PM;And Iâ€™m sitting there with my 11th wool shirt looking at this guy;;
hot boy#6161;14-Sep-18 08:16 PM;Like Square Enix can I have some real armor too;;
Thelitedragon#4507;14-Sep-18 08:16 PM;Tryna level up dark knight;;
Thelitedragon#4507;14-Sep-18 08:16 PM;I made Shinji craft armor for me;;
hot boy#6161;14-Sep-18 08:17 PM;Dude literally went into the dungeon with some shitty Hand clothing;;
hot boy#6161;14-Sep-18 08:17 PM;Left with full armor;;
Thelitedragon#4507;14-Sep-18 08:17 PM;Did he get it in the loot?;;
hot boy#6161;14-Sep-18 08:17 PM;Yeah;;
Thelitedragon#4507;14-Sep-18 08:17 PM;lol click need for each item then;;
hot boy#6161;14-Sep-18 08:17 PM;All the loot and quest reward are tank gear itâ€™s disgusting;;
hot boy#6161;14-Sep-18 08:18 PM;But I donâ€™t want that armor Iâ€™m a dragoon lol;;
hot boy#6161;14-Sep-18 08:18 PM;I canâ€™t equip any of that shy;;
hot boy#6161;14-Sep-18 08:18 PM;Shit*;;
Thelitedragon#4507;14-Sep-18 08:18 PM;You can equip DoW armor;;
Thelitedragon#4507;14-Sep-18 08:18 PM;And lancer armor;;
Thelitedragon#4507;14-Sep-18 08:18 PM;"Actually, you can probably buy it from shops";;
hot boy#6161;14-Sep-18 08:18 PM;The quests and duties all give armor that conveniently is equippable by everyone but dragoon;;
hot boy#6161;14-Sep-18 08:19 PM;That armor is shit armor;;
hot boy#6161;14-Sep-18 08:19 PM;The tanks get cool looking armor;;
hot boy#6161;14-Sep-18 08:19 PM;For free from all the quests lol;;
hot boy#6161;14-Sep-18 08:19 PM;And Iâ€™m stuck buying â€œhempen doubletâ€ or some other shit similar to that;;
hot boy#6161;14-Sep-18 08:19 PM;â€œLeather chaussetteâ€;;
hot boy#6161;14-Sep-18 08:20 PM;Like ok;;
hot boy#6161;14-Sep-18 08:20 PM;Thereâ€™s low lvl dragoon/lancer armor in the player market;;
hot boy#6161;14-Sep-18 08:20 PM;But you canâ€™t even buy it in the normal shop and no quests give it;;
Thelitedragon#4507;14-Sep-18 08:55 PM;What level are you anyways;;
Thelitedragon#4507;14-Sep-18 08:55 PM;Cuz you get some cool armor for all jobs when you finish up their class storylines up to 50;;
themockingguy#6969;14-Sep-18 08:59 PM;@lilvon#5479 I saw you where online 5 hours ago ðŸ‘€;;
themockingguy#6969;14-Sep-18 09:00 PM;Are you logging in later too?;;
Thelitedragon#4507;14-Sep-18 09:01 PM;ðŸ‘€;;
Thelitedragon#4507;14-Sep-18 09:01 PM;I'm gonna log in later;;
hot boy#6161;15-Sep-18 12:40 AM;im almost lvl 50;;
hot boy#6161;15-Sep-18 12:41 AM;lv 46 i think;;
Thelitedragon#4507;15-Sep-18 12:43 AM;weird;;
Thelitedragon#4507;15-Sep-18 12:43 AM;"Might be able to buy Ironworks gear at Mor Dhona, but you'll need a lot of Poetic tomestones";;
hot boy#6161;15-Sep-18 12:47 AM;i havent even gone to that place yet;;
hot boy#6161;15-Sep-18 12:47 AM;its in uldah right?;;
Thelitedragon#4507;15-Sep-18 12:48 AM;Mor Dhona? It's in Mor Dhona lol;;
hot boy#6161;15-Sep-18 12:48 AM;oh...;;
Thelitedragon#4507;15-Sep-18 12:48 AM;It's its own separate place;;
hot boy#6161;15-Sep-18 12:48 AM;i mean the uldah region;;
hot boy#6161;15-Sep-18 12:48 AM;not the city;;
hot boy#6161;15-Sep-18 12:48 AM;its connected to it right;;
hot boy#6161;15-Sep-18 12:49 AM;thanalan;;
Thelitedragon#4507;15-Sep-18 12:49 AM;It's connected to northern thanalan;;
Thelitedragon#4507;15-Sep-18 12:49 AM;And Coerthas;;
Caius#6568;15-Sep-18 02:22 AM;You start getting Dragoon armour at 45 from the class quests. Unfortunately in HW it does the same in leveling in that you go to shirts and shite again. But towards 58 you get a full armour set again (looks like the tank set but black). SB level gear for dragoon is pretty nice. Most of the decent looking armoured sets for goon come at the caps 50/60/70. But tbh that's the same with all the classes really;;
Caius#6568;15-Sep-18 02:23 AM;When I say dragoon armour at 45 I mean the actual set they show you on the character creator and the intro vision;;
Thelitedragon#4507;15-Sep-18 02:31 AM;I remember it being the same deal with other classes;;
Thelitedragon#4507;15-Sep-18 02:31 AM;You get the full sets around 40-45;;
Thelitedragon#4507;15-Sep-18 02:32 AM;I'll keep using Ironworks gear until the end of HW for smn and just use the HQ quest gear for sch;;
Caius#6568;15-Sep-18 02:46 AM;You get all the artifact gear minus the chest piece at 45 and the chest at 50 buts it's just glam stuff by then due to ironworks yeah;;
hot boy#6161;15-Sep-18 03:36 AM;The other classes get full sets way before;;
hot boy#6161;15-Sep-18 03:37 AM;All the story quests give them actual armor;;
hot boy#6161;15-Sep-18 03:37 AM;The armor from the quests just isnâ€™t equipped by dragoon so itâ€™s useless for me;;
Caius#6568;15-Sep-18 03:59 AM;You're getting everything but dragoon stuff?;;
hot boy#6161;15-Sep-18 04:33 AM;yes i have not seen one piece of dragoon armor;;
hot boy#6161;15-Sep-18 04:33 AM;besides in the player market;;
hot boy#6161;15-Sep-18 04:33 AM;you cant buy it in normal shop and no quests give it like i said;;
hot boy#6161;15-Sep-18 04:33 AM;pretty wack;;
hot boy#6161;15-Sep-18 04:34 AM;theres low lvl dragoon armor that seems to be unobtainable unless u make it or something;;
Caius#6568;15-Sep-18 05:02 AM;What level are you?;;
Caius#6568;15-Sep-18 05:09 AM;And server;;
hot boy#6161;15-Sep-18 12:03 PM;46;;
Caius#6568;15-Sep-18 12:28 PM;There's loads of vendors for gear so I'm not sure what you mean;;
Caius#6568;15-Sep-18 12:28 PM;Also you should have all 45 left side apart from chest piece at that level;;
Caius#6568;15-Sep-18 12:29 PM;Have you done your class quests?;;
hot boy#6161;15-Sep-18 12:45 PM;hmm ok im having deja vu;;
hot boy#6161;15-Sep-18 12:45 PM;"if u scroll up, i have answered these questions feel free lol";;
hot boy#6161;15-Sep-18 12:45 PM;"ill just keep playing till i get good stuff, but cmon square enix.";;
hot boy#6161;15-Sep-18 12:46 PM;they must be trying to get ppl to play tank instead of dps;;
Thelitedragon#4507;15-Sep-18 01:28 PM;At that level you are absolutely able to get the good armor from the level 45 class quests;;
Thelitedragon#4507;15-Sep-18 01:28 PM;There's no possible way you haven't gotten them unless you aren't doing your class quests;;
hot boy#6161;15-Sep-18 01:28 PM;the lancer quests end at alvl 30;;
hot boy#6161;15-Sep-18 01:29 PM;dragoon quests dont give any gear so far just abilities;;
Thelitedragon#4507;15-Sep-18 01:33 PM;The quest Double Dragoon gives you all pieces except for the chest;;
Thelitedragon#4507;15-Sep-18 01:33 PM;That's a level 45 quest;;
Thelitedragon#4507;15-Sep-18 01:34 PM;"Into the Dragon's Maw, a level 50 quest, gives you the chest armor";;
Thelitedragon#4507;15-Sep-18 01:34 PM;https://ffxiv.consolegameswiki.com/wiki/Double_Dragoon;;
Thelitedragon#4507;15-Sep-18 01:35 PM;I recommend you do job quests as soon as you are able to;;
Thelitedragon#4507;15-Sep-18 01:35 PM;"If you are level 46, you *are* able to get the gear you want";;
hot boy#6161;15-Sep-18 03:09 PM;im actually in that quest right now;;
hot boy#6161;15-Sep-18 03:10 PM;but i havent played the game in a couple days;;
Baguette Cat#6233;15-Sep-18 04:37 PM;I was wondering about something;;
MajorBroski#8359;15-Sep-18 04:37 PM;Im thinking of playig XIV before I do this student mentorship in about 15 minutes.;;
MajorBroski#8359;15-Sep-18 04:37 PM;But ugh...;;
MajorBroski#8359;15-Sep-18 04:37 PM;Whats up dude?;;
Baguette Cat#6233;15-Sep-18 04:37 PM;If any of you is interested;;
Baguette Cat#6233;15-Sep-18 04:38 PM;"And Bonsoir, sorry";;
MajorBroski#8359;15-Sep-18 04:38 PM;"I think we were texting at the same time, but its all good.";;
Baguette Cat#6233;15-Sep-18 04:38 PM;"I'm currently working on a remaster of my intro video, and was planning on releasing it monday at worst";;
Thelitedragon#4507;15-Sep-18 04:38 PM;***texting***;;
Baguette Cat#6233;15-Sep-18 04:39 PM;"typing, semantics";;
Baguette Cat#6233;15-Sep-18 04:39 PM;But !;;
Baguette Cat#6233;15-Sep-18 04:39 PM;I had an idea;;
Baguette Cat#6233;15-Sep-18 04:39 PM;"My saves in the original FF, and its PSP remake.... are at the end";;
Baguette Cat#6233;15-Sep-18 04:39 PM;"Like, I'm in front of the last dungeon";;
Baguette Cat#6233;15-Sep-18 04:39 PM;"Should I.... stream myself finishing the game, thus beating Chaos?";;
Baguette Cat#6233;15-Sep-18 04:40 PM;"Since, you know, Alphascape is available Tuesday";;
Baguette Cat#6233;15-Sep-18 04:42 PM;"Wishful thinking, nevermind, I'll go back to editing";;
Baguette Cat#6233;15-Sep-18 04:42 PM;Good night;;
Thelitedragon#4507;15-Sep-18 04:42 PM;Bonsoir;;
Thelitedragon#4507;15-Sep-18 04:43 PM;eugh;;
