Author;Date;Content;Attachments;
Joot Doot Lhasa Apso#6440;23-Jul-18 04:12 PM;Which one;;
Joot Doot Lhasa Apso#6440;23-Jul-18 04:12 PM;Yeah the moogle one;;
Joot Doot Lhasa Apso#6440;23-Jul-18 04:12 PM;That fucking DLC is fucked;;
Neon_#1876;23-Jul-18 04:13 PM;O_o;;
Baguette Cat#6233;23-Jul-18 04:13 PM;;https://cdn.discordapp.com/attachments/421131276440043537/471062361671729172/pol_2018-07-23_23-12-46-50.jpg;
Malfred#1000;23-Jul-18 04:14 PM;And I was thinking of A Shantotto Ascension;;
Malfred#1000;23-Jul-18 04:14 PM;Best story to come out of XI;;
Joot Doot Lhasa Apso#6440;23-Jul-18 04:15 PM;Why would they make a dlc like that anyway;;
Joot Doot Lhasa Apso#6440;23-Jul-18 04:15 PM;It's cute but evil;;
Baguette Cat#6233;23-Jul-18 04:15 PM;"I'm still paying my sub for it but I don't even play, I'm an idiot";;
Baguette Cat#6233;23-Jul-18 04:16 PM;And I'm just.... 37 at best(kitty) on only monk;;
Malfred#1000;23-Jul-18 04:16 PM;Hah;;
Malfred#1000;23-Jul-18 04:16 PM;I don't even want to think about my levels in XI;;
Malfred#1000;23-Jul-18 04:16 PM;I spent too much time in that fucking game;;
Malfred#1000;23-Jul-18 04:16 PM;Never did beat Ma'at solo;;
Neon_#1876;23-Jul-18 04:18 PM;Did you enjoy XI? I always heard it got torn apart like it was the worst thing ever xD but I never tried it myself;;
Malfred#1000;23-Jul-18 04:18 PM;Yes;;
Malfred#1000;23-Jul-18 04:18 PM;It was a great game for its time;;
Baguette Cat#6233;23-Jul-18 04:18 PM;"In context, it did what it could and turned out great";;
Baguette Cat#6233;23-Jul-18 04:19 PM;Although I never played it back then and only truly had a taste of it in October last year;;
Baguette Cat#6233;23-Jul-18 04:19 PM;Game has become sooooooo much friendlier to newcomers from what I read left and right;;
Neon_#1876;23-Jul-18 04:20 PM;Interesante;;
Malfred#1000;23-Jul-18 04:20 PM;Can confirm;;
Malfred#1000;23-Jul-18 04:20 PM;"The journey from 1-to-99 can be done in a week, probably less";;
Malfred#1000;23-Jul-18 04:21 PM;Whereas the original trip to 75 (or 50 before the first couple of expansions) took 8-9 months for those who played nonstop.;;
Baguette Cat#6233;23-Jul-18 04:22 PM;"You still need to find your way, but there are rather good guides such as the ones from bg-wiki";;
Malfred#1000;23-Jul-18 04:24 PM;Oh yeah;;
Malfred#1000;23-Jul-18 04:24 PM;The Blue Gartr are still around;;
Malfred#1000;23-Jul-18 04:24 PM;A bloody miracle;;
Malfred#1000;23-Jul-18 04:25 PM;"They failed miserably at getting into XIV and keeping relevance, so they dug deep with XI";;
Malfred#1000;23-Jul-18 04:25 PM;And somehow it worked;;
AbroadKew#1016;23-Jul-18 04:32 PM;"When I'm fighting, I am constantly strafing around my opponents. I've only died once and seldom need to use potions or heal. Is it because I'm strafing or...?";;
AbroadKew#1016;23-Jul-18 04:32 PM;"Archer, by the way.";;
AbroadKew#1016;23-Jul-18 04:32 PM;I can't actually tell if I'm being attacked or not half the time.;;
Baguette Cat#6233;23-Jul-18 04:32 PM;"Please, don't do that in dungeon";;
Baguette Cat#6233;23-Jul-18 04:33 PM;"In the wilds, when you're alone or in fates, okay";;
AbroadKew#1016;23-Jul-18 04:33 PM;I was doing it all around Van. He didn't say nothing! :P;;
Baguette Cat#6233;23-Jul-18 04:33 PM;"But not in higher dungeons, there are bosses that cleaves, you'll get oneshot like an idiot ðŸ˜¦";;
AbroadKew#1016;23-Jul-18 04:34 PM;Aww. I don't want my little falafel to get one shot!;;
Baguette Cat#6233;23-Jul-18 04:35 PM;"Remember that in dungeons, trials and raids, if you don't know the place or fight, never go farther the tank";;
Baguette Cat#6233;23-Jul-18 04:35 PM;"Even if he's sluggish, please stay behind him, and behind the bosses";;
AbroadKew#1016;23-Jul-18 04:35 PM;'Cause I don't know if it's a lore/dialogue thing or if I'm missing something but my archer guild buddies tell me to understand my enemies and be stealthy.;;
Baguette Cat#6233;23-Jul-18 04:35 PM;"Also, if you don't know what it is, don't stand in it";;
AbroadKew#1016;23-Jul-18 04:36 PM;Honestly though I'm just spamming my attacks in a way that seems to make sense.;;
AbroadKew#1016;23-Jul-18 04:36 PM;I don't know that little mitelings weakness. I just know he dies if I keep shooting him.;;
Baguette Cat#6233;23-Jul-18 04:37 PM;"At low level, archer is just keep your crit buff up and shoot the other damaging shot";;
Baguette Cat#6233;23-Jul-18 04:37 PM;"When you get into Bard, you get songs, and your dots actually start to matter";;
Baguette Cat#6233;23-Jul-18 04:47 PM;@themockingguy#6969 WoC Warrior of Croissant;;
themockingguy#6969;23-Jul-18 04:48 PM;:HAHAHAHAHA:;;
themockingguy#6969;23-Jul-18 04:48 PM;"Croissants are delicious, my favorite type of bread hands down";;
Baguette Cat#6233;23-Jul-18 04:48 PM;"But I don't really like croissants, actually >.>";;
Baguette Cat#6233;23-Jul-18 04:49 PM;I like pains au chocolat and pains aux raisins;;
Baguette Cat#6233;23-Jul-18 04:49 PM;But Warrior of Raisins becomes....;;
themockingguy#6969;23-Jul-18 04:49 PM;Here in mexico theres a place that makes Croissants filled with chocolate and it's amazing;;
themockingguy#6969;23-Jul-18 04:50 PM;;https://cdn.discordapp.com/attachments/421131276440043537/471071560615198722/unknown.png;
themockingguy#6969;23-Jul-18 04:50 PM;we're getting off topic;;
Malfred#1000;23-Jul-18 04:50 PM;"So WoD isn't World of Darkness, but rather Warrior of D-...";;
themockingguy#6969;23-Jul-18 04:51 PM;:lewdthink:;;
Baguette Cat#6233;23-Jul-18 04:53 PM;And I don't really want to stream FF14 >.>;;
Baguette Cat#6233;23-Jul-18 04:53 PM;"Or that would be leveling my character on Siren, maybe";;
themockingguy#6969;23-Jul-18 05:03 PM;Do it;;
Baguette Cat#6233;23-Jul-18 05:03 PM;No;;
Baguette Cat#6233;23-Jul-18 05:03 PM;That'll distract me from my Kefka videos ðŸ˜¦;;
themockingguy#6969;23-Jul-18 05:04 PM;then stream XIV on your main;;
themockingguy#6969;23-Jul-18 05:04 PM;I would watch;;
Baguette Cat#6233;23-Jul-18 05:05 PM;I barely do anything >.>;;
Baguette Cat#6233;23-Jul-18 05:05 PM;I'm not in a static;;
Baguette Cat#6233;23-Jul-18 05:05 PM;My fc.... deflated;;
Baguette Cat#6233;23-Jul-18 05:05 PM;Because dramas;;
Baguette Cat#6233;23-Jul-18 05:06 PM;So I'd only be doing some weekly crafting for the 2 girls;;
Baguette Cat#6233;23-Jul-18 05:06 PM;"Do a daily dungeon, trial and raid and log off";;
lilvon#5479;23-Jul-18 05:38 PM;You should grab your girls & bring em to Siren. ðŸ‘€;;
Baguette Cat#6233;23-Jul-18 05:39 PM;For the scrips;;
Baguette Cat#6233;23-Jul-18 05:40 PM;Redhead dragon girl and blond catgirl;;
Baguette Cat#6233;23-Jul-18 05:40 PM;N' something;;
Baguette Cat#6233;23-Jul-18 05:48 PM;"Good night, I need to be up earlier than the last 2 days, I still have the Final Kefka voice overs to record";;
themockingguy#6969;23-Jul-18 05:51 PM;cya!;;
Neon_#1876;23-Jul-18 06:44 PM;Ok sooo I get the basic THM rotation of Thunder > Fire > Transpose > Blizzard blah blah mp management but is there going to be any real use for Scathe or Drain when I get them?;;
Neon_#1876;23-Jul-18 06:44 PM;And if so where would they fit into that ðŸ¤”;;
themockingguy#6969;23-Jul-18 06:51 PM;"Drain is a role class action, and iirc, it doesnt have much use outside of low level stuff (when you get BLM you will only have 5 slots)";;
themockingguy#6969;23-Jul-18 06:52 PM;and scathe is (I think) for when you have to move so you can cast something while you move and keep dpsing;;
themockingguy#6969;23-Jul-18 06:52 PM;Ideally in BLM you don't move;;
Neon_#1876;23-Jul-18 06:55 PM;Ahh ok nice. I guess cuz of the instant cast time? I was picturing it as one of those OH SNAP moment type moves lol;;
Neon_#1876;23-Jul-18 07:02 PM;Thanks for the help *tips cap*;;
themockingguy#6969;23-Jul-18 07:09 PM;no problem;;
themockingguy#6969;23-Jul-18 10:08 PM;I just beat kefka!;;
lilvon#5479;23-Jul-18 10:13 PM;Noice!;;
lilvon#5479;23-Jul-18 10:13 PM;Kefka fights super fun.;;
themockingguy#6969;23-Jul-18 10:25 PM;Yeah it is;;
Baguette Cat#6233;24-Jul-18 08:20 AM;Which one? Normal or savage ðŸ˜® ?;;
Baguette Cat#6233;24-Jul-18 08:20 AM;(asking this 10 hours later);;
AbroadKew#1016;24-Jul-18 08:53 AM;I did collectors edition upgrade. ðŸ˜®;;
AbroadKew#1016;24-Jul-18 08:53 AM;"Also, Mogstation is a terrible website. It logs me out every time I click a link.";;
lilvon#5479;24-Jul-18 09:13 AM;Yeah... its not that great.;;
lilvon#5479;24-Jul-18 09:13 AM;Ive been meaning to upgrade myself. I want the baby behemoth minion.;;
Left Side Worldwide#6969;24-Jul-18 09:49 AM;Hey guys hear me out?;;
Left Side Worldwide#6969;24-Jul-18 09:49 AM;Jandelaine (Extreme);;
Malfred#1000;24-Jul-18 09:54 AM;BY FIRE BE PURGED EVEN MORE;;
AbroadKew#1016;24-Jul-18 10:39 AM;I don't get it.;;
Baguette Cat#6233;24-Jul-18 10:39 AM;It's a really annoying end of a dungeon boss;;
Baguette Cat#6233;24-Jul-18 10:40 AM;And a mandatory dungeon/duty;;
Malfred#1000;24-Jul-18 10:45 AM;And he says By fire be purged! a lot;;
Malfred#1000;24-Jul-18 10:45 AM;(Extreme) are more difficult versions of trials/boss encounters.;;
Malfred#1000;24-Jul-18 10:45 AM;Hence the BY FIRE BE PURGED EVEN MORE;;
themockingguy#6969;24-Jul-18 11:04 AM;"@Baguette Cat#6233 Normal, I'm not ready for savage just yet";;
themockingguy#6969;24-Jul-18 11:06 AM;Last night I wasted 30 minutes of my life by queueing up fo Deltascape v4 (savage) thinking i queued for Sigmascape v4;;
Baguette Cat#6233;24-Jul-18 11:19 AM;"Guuuuuuuuh, I'm done with recording Kefka's voice overs >.>";;
Baguette Cat#6233;24-Jul-18 11:19 AM;My throat hurts;;
Baguette Cat#6233;24-Jul-18 11:20 AM;"And @themockingguy#6969 , did you see the picture I decided on for the twitch account?";;
themockingguy#6969;24-Jul-18 11:21 AM;No ðŸ‘€;;
Baguette Cat#6233;24-Jul-18 11:21 AM;;https://cdn.discordapp.com/attachments/421131276440043537/471351159651696654/Dolly_face_a_une_baguette.JPG;
themockingguy#6969;24-Jul-18 11:21 AM;<a:ablobaww:396521774461747210>;;
themockingguy#6969;24-Jul-18 11:22 AM;Absolutely adorable;;
Baguette Cat#6233;24-Jul-18 11:24 AM;The head tilt makes her say What do you want me to do with this? or Why isn't it a full baguette?;;
Baguette Cat#6233;24-Jul-18 11:25 AM;Nooooo;;
Baguette Cat#6233;24-Jul-18 11:26 AM;BaguetteCat already exists U__U;;
themockingguy#6969;24-Jul-18 11:30 AM;How about baguetteKitty?;;
Baguette Cat#6233;24-Jul-18 11:30 AM;"Baguette_Cat is available, whew";;
AbroadKew#1016;24-Jul-18 12:07 PM;I have 8 enevelopes for some reason.;;
AbroadKew#1016;24-Jul-18 12:07 PM;"Is that where I would go to moogle, right?";;
AbroadKew#1016;24-Jul-18 12:07 PM;Also that cat sure is a cutie.;;
AbroadKew#1016;24-Jul-18 12:07 PM;Much like my falaflefelfel.;;
AbroadKew#1016;24-Jul-18 12:14 PM;Is there any reason. I shouldn't activate all these minions?;;
AbroadKew#1016;24-Jul-18 12:14 PM;Or mounts?;;
Left Side Worldwide#6969;24-Jul-18 12:16 PM;"For like, 99% of them, no just use them";;
AbroadKew#1016;24-Jul-18 12:16 PM;And the 1%?;;
Left Side Worldwide#6969;24-Jul-18 12:16 PM;They're worth hella gil on the market board;;
Left Side Worldwide#6969;24-Jul-18 12:16 PM;"But that's like, something you'd farm for";;
AbroadKew#1016;24-Jul-18 12:16 PM;Ah well the ones I got can't be traded anyways;;
Left Side Worldwide#6969;24-Jul-18 12:16 PM;Yeah;;
Left Side Worldwide#6969;24-Jul-18 12:17 PM;I'm talking about things like the Heaven-on-High Dodo mount which is like 15 million gil;;
AbroadKew#1016;24-Jul-18 12:17 PM;Are the minions and mount I got from collectors now locked to this one character?;;
Left Side Worldwide#6969;24-Jul-18 12:17 PM;"I have no idea, I didn't get the collector's edition";;
AbroadKew#1016;24-Jul-18 12:23 PM;"Beginning storyline is different depending on class, right? Or does everyone start in NG?";;
Left Side Worldwide#6969;24-Jul-18 12:25 PM;Your starting city is dependent on which class you take;;
Left Side Worldwide#6969;24-Jul-18 12:25 PM;"Not that it *really* matters, the first 15 levels play out more or less the same, just with different backdrops.";;
Left Side Worldwide#6969;24-Jul-18 12:26 PM;They all converge after the memorial service.;;
AbroadKew#1016;24-Jul-18 12:26 PM;That's what I was guessing. I just got my airship pass.;;
Left Side Worldwide#6969;24-Jul-18 12:27 PM;"Yeah, once you actually *do* the memorials in each city, about there is when all three beginnings converge into the main story";;
Left Side Worldwide#6969;24-Jul-18 12:27 PM;Or it could be when you get your special item and do the cutscene fucked if I know;;
Left Side Worldwide#6969;24-Jul-18 12:27 PM;In gridania you get some mask;;
AbroadKew#1016;24-Jul-18 12:28 PM;Yup. I got my mask.;;
Left Side Worldwide#6969;24-Jul-18 12:28 PM;Yeah so you're staring to converge into the main story;;
AbroadKew#1016;24-Jul-18 12:28 PM;I am on an airship! :D;;
Left Side Worldwide#6969;24-Jul-18 12:29 PM;"Congrats! You will spend like, no time ever actually using them :HAHAHAHAHA:";;
Thelitedragon#4507;24-Jul-18 12:29 PM;Ain't that the truth...;;
Thelitedragon#4507;24-Jul-18 12:29 PM;You know it took me until lvl 40 until Shinji told me about Chocobos;;
Thelitedragon#4507;24-Jul-18 12:29 PM;Before then I just walked everywhere...;;
Left Side Worldwide#6969;24-Jul-18 12:30 PM;Jaysus croist;;
AbroadKew#1016;24-Jul-18 12:31 PM;Hahaha;;
AbroadKew#1016;24-Jul-18 12:31 PM;You never saw the chocolate markers?;;
AbroadKew#1016;24-Jul-18 12:31 PM;Chocobo;;
Malfred#1000;24-Jul-18 12:32 PM;"I have so many fat cat minions that I should just start handing them out to newcomers, either they can use them or sell them for a quick 200k gil";;
AbroadKew#1016;24-Jul-18 12:32 PM;HI I am a newcomer.;;
Malfred#1000;24-Jul-18 12:32 PM;"That's on my main on Hyperion, not on Siren";;
Malfred#1000;24-Jul-18 12:33 PM;https://img2.finalfantasyxiv.com/accimg/05/7f/057f83d665d9e0e2abe4e1b683fb002f81b5f01e.jpg;;
Malfred#1000;24-Jul-18 12:33 PM;Fat cat;;
AbroadKew#1016;24-Jul-18 12:33 PM;Oh my god;;
Malfred#1000;24-Jul-18 12:33 PM;It was worth about 5 mil when it was first released;;
Neon_#1876;24-Jul-18 12:54 PM;O_o;;
Neon_#1876;24-Jul-18 12:54 PM;How *is* the games economy at this point?;;
Neon_#1876;24-Jul-18 12:57 PM;I guess specifically I mean is everything still a fairly viable way to generate gil? Or are there certain crafts that have become kind of useless?;;
Left Side Worldwide#6969;24-Jul-18 01:25 PM;You gotta be fucking kidding me right now;https://cdn.discordapp.com/attachments/421131276440043537/471382447595192351/2018-07-24_1.png;
Malfred#1000;24-Jul-18 01:38 PM;Kidding you in regards to?;;
Malfred#1000;24-Jul-18 01:38 PM;And yes @Neon_#1876 every craft is still a viable source of income;;
lilvon#5479;24-Jul-18 01:40 PM;Lol is he still their? I can hop on & knock him out the way!;;
lilvon#5479;24-Jul-18 02:05 PM;Heads up I've added a materia melder to the house NPCs downstairs so you can now do that at home lol;;
themockingguy#6969;24-Jul-18 02:36 PM;Noice!;;
Left Side Worldwide#6969;24-Jul-18 03:57 PM;fucking lmao;https://cdn.discordapp.com/attachments/421131276440043537/471420705766899753/2018-07-24_2.png;
themockingguy#6969;24-Jul-18 04:00 PM;Are those bots?;;
Left Side Worldwide#6969;24-Jul-18 04:05 PM;Yeah;;
themockingguy#6969;24-Jul-18 05:00 PM;"I just noticed the queue time, wow";;
themockingguy#6969;24-Jul-18 05:00 PM;how much did you ended up waiting?;;
Left Side Worldwide#6969;24-Jul-18 05:00 PM;Like 24 minutes or so;;
Left Side Worldwide#6969;24-Jul-18 05:09 PM;:9999:;https://cdn.discordapp.com/attachments/421131276440043537/471438796026544138/unknown.png;
AbroadKew#1016;24-Jul-18 05:23 PM;"Whoa, your hud is crazy different than Sazh.";;
AbroadKew#1016;24-Jul-18 05:23 PM;Why you still have newbie symbol?;;
Baguette Cat#6233;24-Jul-18 05:24 PM;"You can change your HUD with the options, but also because he's on PC";;
Baguette Cat#6233;24-Jul-18 05:24 PM;I think you said you were on PS4 ?;;
themockingguy#6969;24-Jul-18 05:25 PM;"Yeah, you can move every element on the secren and resize it";;
Baguette Cat#6233;24-Jul-18 05:27 PM;Look at mine;https://cdn.discordapp.com/attachments/421131276440043537/471443238616825868/ffxiv_dx11_2018-07-25_00-26-50-29.jpg;
themockingguy#6969;24-Jul-18 05:27 PM;Aire d'effet;;
themockingguy#6969;24-Jul-18 05:28 PM;french is so funny to me;;
Baguette Cat#6233;24-Jul-18 05:28 PM;It's aoe;;
Baguette Cat#6233;24-Jul-18 05:28 PM;literally translated from area of effect;;
Baguette Cat#6233;24-Jul-18 05:31 PM;I'll try to work hard to get those Kefka videos done;;
Left Side Worldwide#6969;24-Jul-18 05:52 PM;"@AbroadKew#1016 I have the sprout icon because I'm on a different character that I made like a week or two ago. My main character doesn't have the sprout, and in fact has the Mentor crown.";;
AbroadKew#1016;25-Jul-18 01:22 AM;Yeah I saw those HUD options when I first loaded up but it was all scary and strange. :D;;
AbroadKew#1016;25-Jul-18 01:23 AM;I remember hearing how in Wow back in day that you had to do all this trickery. FFXIV makes it all easy.;;
AbroadKew#1016;25-Jul-18 01:23 AM;Do y'all rely on mouse to use attacks and such? Or hotkeys?;;
AbroadKew#1016;25-Jul-18 01:24 AM;And I'm PC;;
Thelitedragon#4507;25-Jul-18 01:25 AM;Mouse;;
Thelitedragon#4507;25-Jul-18 01:25 AM;hahaha jk;;
Thelitedragon#4507;25-Jul-18 01:25 AM;Most people use hotkey;;
Left Side Worldwide#6969;25-Jul-18 02:27 AM;"If I'm lazy I'll just use the mouse, like just casually leaning back in my chair";;
Left Side Worldwide#6969;25-Jul-18 02:27 AM;Anything serious though I sit up and use hotkeys;;
AbroadKew#1016;25-Jul-18 03:20 AM;I saw some videos of the controller use in FFXIV and it actually looks pretty darn good. I was debating it especially after Van told me he uses controller 'cause he was pro killing some mobs with me.;;
Left Side Worldwide#6969;25-Jul-18 04:48 AM;I still wouldn't. It's something you'd have to dedicate yourself to and even then keyboards are just straight up more efficient;;
themockingguy#6969;25-Jul-18 12:39 PM;;https://cdn.discordapp.com/attachments/421131276440043537/471733343453708288/uovtnxtvbsb11.png;
Neon_#1876;25-Jul-18 12:56 PM;Its very well done for controller but its just less convenient;;
Baguette Cat#6233;25-Jul-18 12:57 PM;@themockingguy#6969 I just did that in Ramuh roulette;;
Baguette Cat#6233;25-Jul-18 12:57 PM;Guy was spamming Melee LB;;
Baguette Cat#6233;25-Jul-18 12:57 PM;So I used it... as a black mage :p;;
themockingguy#6969;25-Jul-18 01:00 PM;"When I was clearing tsukuyomi all DPS's where casters, I used lb3 and the tank blamed me bc, according to him, we died bc no one could see the AOE's";;
themockingguy#6969;25-Jul-18 01:01 PM;"but the AOE started before I casted the lb3 so, they did had a chance to see the aoe's beforehand";;
lilvon#5479;25-Jul-18 02:47 PM;"it really just depends on whats most comfortable to you. If you're an MMO  vet than M+KB is probably the way to go, but if you are used to playing games on controller than FFXIV isnt much different froma any other action  game or RPG";;
lilvon#5479;25-Jul-18 02:47 PM;"One stick moves your  character, the other the camrera";;
lilvon#5479;25-Jul-18 02:47 PM;buttons do stuff.;;
Baguette Cat#6233;25-Jul-18 02:48 PM;I love the changes made to the black mage in Storm Blood;;
Baguette Cat#6233;25-Jul-18 02:49 PM;"And Foul looks so.... I don't know, cool? I really like it, and the sound";;
Baguette Cat#6233;25-Jul-18 02:51 PM;Trash packs are just melting;;
lilvon#5479;25-Jul-18 02:51 PM;havent tried 4.0 blm I dislike the Heavensward changes & 4.0 just seems to build on top of those;;
lilvon#5479;25-Jul-18 02:52 PM;when Firaja refreshes Astral Fire buff ill comeback.;;
Baguette Cat#6233;25-Jul-18 02:52 PM;"Foul, Flare, Flare, CD that turns my HP to MP, Flare and Foul";;
lilvon#5479;25-Jul-18 02:52 PM;Convert;;
Baguette Cat#6233;25-Jul-18 02:52 PM;Thanks;;
Baguette Cat#6233;25-Jul-18 02:53 PM;"I feel like Bahamut if I time it correctly, and the tank isn't a pansy";;
Diabetus#1452;26-Jul-18 12:00 PM;i need a ps4 to truly enjoy this game;;
Diabetus#1452;26-Jul-18 12:00 PM;or else il just crash;;
lilvon#5479;26-Jul-18 12:06 PM;That or a better PC;;
Baguette Cat#6233;26-Jul-18 12:46 PM;"I tried to stream FF14, and OBS didn't like it";;
Baguette Cat#6233;26-Jul-18 12:48 PM;But simply playing is no problem;;
Left Side Worldwide#6969;26-Jul-18 02:14 PM;Stream problems are either network or CPU;;
Baguette Cat#6233;26-Jul-18 02:14 PM;"CPU, network isn't an issue now";;
Baguette Cat#6233;26-Jul-18 02:15 PM;"I haven't tried 3d games like FF7 or 8 yet, but so far, it seems that my comp can only handle 2D games, like FF6 GBA";;
Left Side Worldwide#6969;26-Jul-18 02:16 PM;What kind of CPU do you have?;;
Baguette Cat#6233;26-Jul-18 02:20 PM;"i7-3630QM CPU@ 2.40GHz, GTX660";;
Baguette Cat#6233;26-Jul-18 02:26 PM;"I know I could just release the pressure through another comp, or some kind of outer box (forgot how it's called)";;
Baguette Cat#6233;26-Jul-18 02:26 PM;But the other computer isn't mine and I'll need to move a bunch of things away to set myself correctly;;
Baguette Cat#6233;26-Jul-18 02:26 PM;"And the other box is out of my reach, money wise";;
Left Side Worldwide#6969;26-Jul-18 02:29 PM;Your GPU could actually be bottlenecking you;;
Left Side Worldwide#6969;26-Jul-18 02:29 PM;"Oh, wait, hang on";;
Left Side Worldwide#6969;26-Jul-18 02:30 PM;"Okay you're on a laptop, that complicates matters";;
Baguette Cat#6233;26-Jul-18 02:31 PM;"Yeah, it was good when I bought it, but it's been 4/5 years already >.>";;
Baguette Cat#6233;26-Jul-18 02:31 PM;I'll just keep it low with 2d games for now;;
Left Side Worldwide#6969;26-Jul-18 02:31 PM;"Yeah, streaming is pretty CPU intensive";;
Baguette Cat#6233;26-Jul-18 02:31 PM;I have some beef with A Link to the Past and Super Mario Kart;;
Baguette Cat#6233;26-Jul-18 02:39 PM;"I tried with FF14 but it quickly got stuck in a loop of 1 still picture and 2 sounds, even OBS kept crashing -___-";;
AbroadKew#1016;28-Jul-18 11:50 AM;La'von Hawke!;;
AbroadKew#1016;28-Jul-18 11:51 AM;I thought your name was Van in here but I find nobody!;;
AbroadKew#1016;28-Jul-18 12:10 PM;Modifying my HUD hurt my wrist. Sure wish you could've them with arrow keys.;;
AbroadKew#1016;28-Jul-18 12:13 PM;@lilvon#5479 Hi.;https://cdn.discordapp.com/attachments/421131276440043537/472813746595692544/unknown.png;
AbroadKew#1016;28-Jul-18 12:13 PM;"It was Von, not Van. That's why I couldn't find ya.";;
AbroadKew#1016;28-Jul-18 12:26 PM;They wanted to do this dungeon with me but they gone;;
AbroadKew#1016;28-Jul-18 12:43 PM;"Dododo, doop foop";;
AbroadKew#1016;28-Jul-18 12:47 PM;"Tag me @lilvon#5479 when you ready to rock, I've got about 2 hours left on shift to play! ðŸ˜ƒ";;
AbroadKew#1016;28-Jul-18 02:50 PM;I wonder if he's still sitting there.;;
Left Side Worldwide#6969;28-Jul-18 03:01 PM;W H A T ? !;https://cdn.discordapp.com/attachments/421131276440043537/472856103190003722/unknown.png;
lilvon#5479;28-Jul-18 03:19 PM;@AbroadKew#1016 bro im so sorry I fell asleep!;;
lilvon#5479;28-Jul-18 03:19 PM;I see you logged off like 2 hours ago. I promise I didnt mean to leave you hanging!;;
AbroadKew#1016;28-Jul-18 03:45 PM;"haha, that's what I figured.";;
AbroadKew#1016;28-Jul-18 03:46 PM;I sat in front of you for like 45 minutes. ðŸ˜„;;
Left Side Worldwide#6969;28-Jul-18 05:31 PM;Okay hold the fuck up for a sec;;
Left Side Worldwide#6969;28-Jul-18 05:31 PM;;https://cdn.discordapp.com/attachments/421131276440043537/472893779905347594/unknown.png;
Left Side Worldwide#6969;28-Jul-18 05:31 PM;Urianger said that;;
Left Side Worldwide#6969;28-Jul-18 05:31 PM;Yet not *moments ago* did I just witness the Ascian (I forget his name) teleport out of the solar.;;
Baguette Cat#6233;28-Jul-18 05:32 PM;are wont to employ.... I didn't learn that in school;;
Left Side Worldwide#6969;28-Jul-18 05:37 PM;Urianger speaks in ye olde school english;;
Baguette Cat#6233;28-Jul-18 05:39 PM;"But, didn't he mean that they're reluctant to use it?";;
Left Side Worldwide#6969;28-Jul-18 05:44 PM;No it means they are prone to using it;;
Baguette Cat#6233;28-Jul-18 05:46 PM;Did you mean teleport out of the cellar ?;;
Left Side Worldwide#6969;28-Jul-18 05:46 PM;"No, I meant the solar";;
Left Side Worldwide#6969;28-Jul-18 05:46 PM;That's what they call that particular instanced area;;
Left Side Worldwide#6969;28-Jul-18 05:46 PM;I have no idea why;;
Baguette Cat#6233;28-Jul-18 05:47 PM;"Remember that I played most of the game in french, so I'm not used to the english names for the locations >.>";;
Left Side Worldwide#6969;28-Jul-18 05:47 PM;Â¯\_(ãƒ„)_/Â¯;;
Baguette Cat#6233;28-Jul-18 05:48 PM;So.... did you mean that Urianger saw the Ascian walks out while you saw it actually teleports out?;;
Left Side Worldwide#6969;28-Jul-18 05:48 PM;Correct;;
Baguette Cat#6233;28-Jul-18 05:49 PM;"Sorry, I'm half asleep, and I didn't get what are wont mean.";;
Baguette Cat#6233;28-Jul-18 05:49 PM;"Yeah, it might be a hiccup on the localization team, or a mistake, like Elidibus wasn't supposed to teleport but just walk";;
Baguette Cat#6233;28-Jul-18 05:50 PM;And it didn't get change in the original text;;
Left Side Worldwide#6969;28-Jul-18 05:54 PM;Â¯\_(ãƒ„)_/Â¯;;
Baguette Cat#6233;28-Jul-18 05:55 PM;"But you know, it's just a theory....";;
Baguette Cat#6233;28-Jul-18 05:55 PM;**A GAME THEORY**;;
AbroadKew#1016;28-Jul-18 09:48 PM;Relevant reference;;
AbroadKew#1016;28-Jul-18 09:49 PM;Was just reading about them 2 days ago;;
themockingguy#6969;30-Jul-18 12:13 AM;"And so, the blue red mage was born";https://cdn.discordapp.com/attachments/421131276440043537/473357514348429312/FB_IMG_1532927577432.jpg;
lilvon#5479;30-Jul-18 02:42 AM;Noice!;;
lilvon#5479;30-Jul-18 02:42 AM;I think you meld... crit for RDM?;;
AbroadKew#1016;30-Jul-18 03:52 AM;wwwoooop;;
AbroadKew#1016;30-Jul-18 03:53 AM;Another falafel!;;
AbroadKew#1016;30-Jul-18 03:53 AM;We in the club.;;
Malfred#1000;30-Jul-18 06:20 AM;"Took a while, but I finally managed to max out rep with the Vanu Vanu";;
